Organization Name,Address
Loadshare Networks,"509, 6th Cross Rd, 6th Block, Koramangala, Bengaluru, Karnataka 560095"
Locus.sh,"8th Floor, 167 Fleet Street, LONDON, EC4A 2EA"
Locus.sh,"Mara Labs UG/Orrick, Herrington LL, Heinrich-Heine-Allee 1, 40213 Dusseldorf"
Locus.sh,"Lodha Supremus Opposite Mtnl Off Jvlr, Saki Vihar Road Powai, Saki Vihar Rd, Mumbai, Maharashtra 400072"
Locus.sh,"87-148, 4th Floor, Mayur Greens, 1st Block Koramangala, Bengaluru, Karnataka 560034"
Locus.sh,"CirCO , Building : 222 Dien Bien Phu , ward 7 , District 3 Office No : S07.02"
Locus.sh,"7 TEMASEK BOULEVARD, #12-07 SUNTEC TOWER ONE SINGAPORE (038987)"
Locus.sh,"Suite 217, 691 S Milpitas, Milpitas CA 95035"
Locus.sh,"Menara Prima 5th Floor, Jl. DR. Ide Anak Agung Gde Agung, Kuningan Tim., Kota Jakarta Selatan, Daerah Khusus Ibukota Jakarta 12940"
CartonCloud,"5/27 Dover Dr, Burleigh Heads QLD 4220"
Ripplr,"Intelligent Retail Pvt Ltd, Maithreyi # 1090/L, 3rd floor 18th cross, Sector 3, HSR Layout, Bengaluru, Karnataka-560102"
Ofload,"175 Pitt Street, Sydney, New South Wales 2000, Australia"
Best Beer Japan,"1-8-7 Honcho, Asaka, Saitama Prefecture 351-0011, Japan"
Aerchain,"Number 7, 6th Cross Road, Dollars Colony Stage 2, Bilekahalli ,Bengaluru, Karnataka 560076, India"
Yunmanman,"Floor 3-5, Building 4, Tianchao Science Park, No. 107-1, Software Avenue, Yuhua
Nanjing, Jiangsu 200335, China"
Hakuna Matata Solutions,"914 Railroad Ave, Tallahassee, FL32310, USA"
Hakuna Matata Solutions,"Tower C,  Ground floor, Ratthatek Meadows, Sholinganallur, Chennai - 600119 "
Hakuna Matata Solutions,"St Kilda Rd Towers, 1 Queens Road, Melbourne VIC 3004, Australia"
Feiliu,"Room 502, Block A, Changtai Plaza, Lane 2889, Jinke Road, Pudong New District, Shanghai, China"
teTra aviation,"Bunkyo-ku, Tokyo"
Logikura,"1105 Stoke Shinjuku, 6-12-7 Nishi-Shinjuku, Shinjuku-ku, Tokyo, 160-0023, Japan"
Waytous,"9th Floor, Shouxiang Technology Building, Haidian District, Beijing"
Waytous,"11th Floor, Xinghe Cococity Business Center, Dongsheng District, Ordos City, Inner Mongolia"
Waytous,"15th Floor, Building B, Building 1, Zhongke R&D City, High-tech Zone, Qingdao"
Qianhai Yueshi Information Technology,"7th Floor, Qianhai Yidu Building, No. 99, Gangcheng Street, Nanshan District, Shenzhen"
Qianhai Yueshi Information Technology,"19th and 20th Floor, Dexin Data Industry Building, Yuhang District, Hangzhou"
Freight Exchange Pty Ltd,"Level 2, 11 York Street, Sydney, New South Wales 2000, Australia"
Elixia Tech Solutions,"715, Neelkanth Corporate Park, Near Vidyavihar Railway Station, Vidyavihar West, Mumbai, Maharashtra 400086, India"
Nivaata Systems Pvt Ltd,"Shreyas Plaza, 4th floor, Number 2012, 100 feet road, HAL 2nd Stage, Indiranagar, Bengaluru, Karnataka 560038, India"
Eka Software Solutions,"Eka Software Solutions, Embassy Tech Village SEZ, Phase II, Aster Building 2A, East Tower, Outer Ring Road, Devarabeesanahalli, Bengaluru, 560103, India"
Eka Software Solutions,"Eka Software Solutions Inc, 230 Park Ave, Floors 3 & 4, New York -10169, USA"
Eka Software Solutions,"Eka Software Solutions Ltd,Dorset House, Regent Park, Kingston Road, Leatherhead, Ashtead, KT22 7PL, UK"
Eka Software Solutions,"Eka Canada Inc, C/o, McMillan LLP, 1700, 421-7th Avenue SW, Calgary, AB T2P 4K9"
Eka Software Solutions,"Eka Software Solutions Sàrl, Georges-Favon 8, 1204 Geneva, Switzerland"
Eka Software Solutions,"Eka CTRM Solutions Pty Ltd, Level 5/185, Victoria Square, Adelaide – 5000, SA, Australia"
Eka Software Solutions,"Sybex Mauritius Limited, C/O CIM Global Business, Les Cascades Building, 33, Edith Cavell Street , Port Louis, Mauritius"
207,"3-16-9 Meguro, Meguro-ku, Tokyo, 153-0063, Japan"
Advanced Media,"2F Kawaramachichuo Bld., 2-3-10 Kawaramachi, Chuo-Ku, Osaka-Shi, Osaka,   541-0048"
Advanced Media,"302 Nissin Bld., 1-25-1 Aoi, Higashi-Ku, Nagoya-Shi, Aichi, 461-0004"
Advanced Media,"5F Minamikindai Bld., 4-2-10 Hakataeki Minami, Hakata-Ku, Fukuoka-shi, Fukuoka, 812-0016"
Advanced Media,"42F Sunshine60, 3-1-1 Higashi Ikebukuro, Toshima-Ku, Tokyo,170-6042"
AutocloudPro,"Room 1095, No. 48, Lane 60, Tongji Road, Baoshan District, Shanghai, Shanghai, Shanghai 200940, CN"
Iobot,"B102 Shreenanda Classic Rahatani, Pune, Maharashtra 411017
India"
THOK LOGISTICS,"Fuyu Rd., Honglu Sub-district, Fuqing City Fuzhou, Fujian, 350300 China"
One Key Access,"34 Village Street, Docklands, Victoria 3008, Australia"
56top.cn,"9th Floor, Economic Park, Alumni Enterprise Headquarters, Building 1, Juhua, Science and Technology Park, Number 6 Longzhou Road, Hangzhou, Zhejiang, China"
KITOHA,"Kume Building 6th Floor, 2-25-5 Kamiosaki, Shinagawa-ku, Tokyo, 141-0021, Japan"
Suray,"Shanghai Surui Information Technology Co., Ltd.: Room 505, Building 12, No. 498, Guoshoujing Road, Pudong New Area, Pudong Software Park, Shanghai"
Suray,"Huzhou Columbus Logistics Technology Co., Ltd.: 2F, Building 2, No. 18, Industrial Road, Wuxing District, Huzhou City"
Suray,"Anhui Columbus Intelligent Technology Co., Ltd.: Balinghu Road, Mingguang Economic Development Zone (Zhancheng New District)"
TechBloom,"Floor T6-3, Han's Plaza, Yizhuang Economic and Technological Development Zone, Beijing"
TechBloom,"Room 01, 6th Floor, Dahongqiao International, Li'an Road, Minhang District, Shanghai"
TechBloom,"Room 903-904, Creative Industry Park, 9-3, East Taihu Road, Xinbei District, Changzhou City, Jiangsu Province"
TechBloom,"Suzhou International Science and Technology Park, No. 328 Xinghu Street, Suzhou Industrial Park, Jiangsu Province"
TechBloom,"Room 4110, Block E, Poly World Trade Center, No. 1022, Xingang East Road, Haizhu District, Guangzhou City, Guangdong Province"
TechBloom,"Zhongguancun Collaborative Innovation Wisdom Park, Baohe Economic and Technological Development Zone, Hefei City, Anhui Province"
Jixingtong,"Block E, 5th Floor, Yongyi Building, 100 Hulan West Road, Baoshan District, Shanghai, 201900, China"
E-View,"Room 1701, Block A, Zhongtai International Plaza, No. 161, Linhe West Road, Tianhe District, Guangzhou, China"
GEESE,"5th Floor, Building 4, Phase 3, China Wisdom Information Industrial Park, 88 Xiangyuan Road, Hangzhou, Gongshu District, China"
Airship Logistics,"Philippines, 226 Ortigas Avenue, San Juan City, Metro Manila, Philippines"
Anbaohong Wuliu Lianmeng,"Room 603, Building 32, No. 258, Xinzhuan Road, Songjiang District, Shanghai
(in Songjiang Park, Caohejing Development Zone), 201612"
Carisma,"34 Parer Place (via Musk Avenue), Z1 The Works, Brisbane, QLD 4059, AU"
Travel Distribution Systems,"Level 1 339 Whitehorse Road, Balwyn, Melbourne, Victoria 3103, Australia"
Unscrabble Solutions,"125 York Street, Sydney, New South Wales 2000, Australia"
CargoWise,"72 O'Riordan St, Alexandria, New South Wales 2015, AU"
Qikship,"Sector 2, Noida, 201301, India"
TruckSuvidha,"Number 171, 2nd floor, Brij Puri Colony, Opposite D.A.V school, Govindpuri Road, Yamunanagar, Haryana 135001, India"
Axestrack Software Solutions Pvt.Ltd,"528, 5th floor, Jaipur Electronic Market, Near Riddhi Siddhi Gopalpura Bypass, Jaipur, Rajasthan – 302018 India"
Telyport Technologies,"158 West 27th, Floor 6, New York, NY 10001, United States"
ORMAE,"8 The Green, Dover, Delaware 19901, US"
ORMAE,"Sharjah Media City Free Zone , Sharjah, Sharjah 99999, AE"
ORMAE,"Akshayanagar , akshayanagar , Bengaluru , Karnataka 560076, IN"
Info-X Software Technology Pvt. Ltd.,"335, Phase II, Udyog Vihar, Gurugram, Haryana-122016"
trackNOW,"B-308, Mondeal Heights, Nr. Hotel Novotel, S. G. Highway, Ahmedabad – 380015, Gujarat, INDIA."
Virtual Control,"Office A, 10/F, 91-97 Jervois Street, Sheung Wan, Hong Kong"
Radaro,"6400 Flying Cloud Dr., Eden Prairie, MN 55344, United States"
Radaro,"1/1501 Malvern Rd, Glen Iris VIC 3146, Australia"
Jaix Logistics Software,"2/129 B26, Unley SA 5061, Australia"
Swivel Software,"Unit 310, Building 16W, No. 16 Science Park West Avenue, HKSTP, Shatin, NT, Hong Kong"
Swivel Software,"Level 14 Hibiya Central Building, 1-2-9 Nishi Shinbashi, Minato-Ku, Tokyo 105-0003 JP  "
Swivel Software,"115 W California Boulevard #1058 Pasadena, CA 91105"
Myfreight,"7133 West 95th Street, Suite 205, Overland Park, KS 66212, United States"
Revolo Infotech,"104, Prospect Chambers, Dr D.N Nagar Road, Fort, CST, Mumbai, Maharashtra 400001, IN"
Brevity Software Solutions,"3rd Floor, Purusharth Plaza,, Near Peoples Bank, Amin Marg, Rajkot, Gujarat 360002, IN"
Spingine,"Unit 3410 Cityland Pasong Tamo Tower 2, 2210 Don Chino Roces Avenue, Makati City"
Spingine,"Francesca Dawn Bldg., No. 24 Orchid Road, Capitol Site, Cebu City Philippines,"
LogixGRID,"S-37, Second Floor, Baani Square, Sector-50, Gurgaon, Haryana 122018"
XShoppy,"4th Floor, Block A, Tongfang Information Port, Langshan Road, Nanshan District, Shenzhen City, Guangdong Province, Shenzhen Sailing Technology Co., Ltd."
Marlin AI,"Benoi Sector, No.21, Singapore 629853"
GPSGaadi,"F-35/3 Pocket B, Okhla Phase II, Okhla Industrial Estate New Delhi, Delhi, 110020"
GPSGaadi,"CRYSTAL IT PARK, INDORE, MADHYA PRADESH, 452020"
ScanSKU,"3 Germay Dr., Ste 4 – 4737, Wilmington DE 19804"
iInterchange,"“VS&B Niketan”, Y–8‚ 9th Street‚ Anna Nagar, Chennai – 600 040‚ India."
Cadence Data Soft Pvt. Ltd.,"E Lake Mary Blvd, Sanford, Florida 32773, US"
Cadence Data Soft Pvt. Ltd.,"La Vida Loka, Pimple Saudagar, Pune 411027, INDIA"
BrandLink,30 Agar Drive Tennancy No. 2 Truganina VIC 3029 Australia
BrandLink,16B Tyrone Pl Erskine Park NSW 2759 Australia
SmartBee Intelligence,"Taipei, Taiwan 104, TW"
Cyberfreight,Unit 8B 443 West Botany Street Rockdale NSW 2216
Cyberfreight,"4th Floor, 33-45 Hurstmere Road Takapuna, Auckland 0622"
Cyberfreight,"750A Chai Chee Road #07-17 Viva Business Park, Singapore 469001"
Waylar tech,"5C 5th Floor, 29/1 Phloen Chit Rd, Lumphini, Pathum Wan, Bangkok 10330"
WinCreate,"3-23-3 Kanda Jimbocho, Chiyoda-ku, Tokyo Maison Chiyoda 7F"
Dynamic Solutions and Advanced Technologies,"898/32B, 19TH FLOOR, Office Tower 2, SV CITY, RAMA 3 ROAD, Bang Pong Pang, YANNAWA, BANGKOK 10120, THAILAND"
Dynamic Solutions and Advanced Technologies,"No: 01, 2nd Floor, Janaki Nagar, Arcot road, Valsaravakkam, CHENNAI 600087 TAMIL NADU, INDIA"
Dynamic Solutions and Advanced Technologies,"B-3-2, BBT One The Towers, Lebuh Batu Nilam 1, Bandar Bukit Tinggi, 41200 Klang, Selangor, Malaysia"
Dynamic Solutions and Advanced Technologies,Prince Sultan Street – Taj Al Sultan Building Jeddah City – Kingdom of Saudi Arabia
Alliancc Art Group,"China, Guangdong Province, Shenzhen, Nanshan, Creative Culture Park"
Caesar Software Pvt. Ltd,"405, SAPTARANG AKASH SOCIETY OPP PHURSUNGI GRAM PANCHAYAT, NEAR SP INFOCITY, PHURSUNGI, HADAPSAR  PUNE MAHARASHTRA INDIA 412308"
Wisdom Cloud Service,"6th Floor, Building 2, No. 170-1, Software Avenue, Yuhuatai District, Nanjing City, Jiangsu Province"
SAM Computer Systems,485 Great South Road Penrose Auckland 1061 New Zealand
QA Chef,"Level 2, 11 York St Sydney, NSW 2000"
Domex Technical Information Pvt. Ltd.,"RF3 Kakad Chambers Annexe, 1st Floor, Annie Besant Road, Next to Poddar Hospital, Worli, Mumbai - 400 018."
Domex Technical Information Pvt. Ltd.,"208 Kaveri Complex , Nungambakkam High Road Nungambakkam, Chennai 600034, INDIA."
Mash Corporation,"Syougyou Bldg. 7F,5-6-10 Toyosaki, Kita-ku, Osaka
531-0072, Japan"
Mash Corporation,"Nihonkochiku 2 Bldg. 5F, 2-7-15 Hamamatsu-cho, Minato-ku, Tokyo
105-0013, Japan"
Customer Logic,"4 CHALLENGE CT SUNSHINE BEACH, QUEENSLAND, 4567 Australia"
EC Robo,"3F, 2-9-8, Akebono, Chiba, 277-0841, Japan"
iGateway System,"No36 & 37, Vijay Nivas Vinayaka Layout, Uttarahalli Bangalore-560 061. INDIA."
Intellismart Information technologies Pvt Ltd,"SYNO:154,D-501,BACHUPALLY NEVILLE SUNWAY OPUS INT AMEENPOOR, MIYAPUR Hyderabad TG 500049 IN"
Unitech IT Solutions,"140 William Street East Sydney, NSW 2011 PO Box 3222 Parramatta, NSW 2150"
Unitech IT Solutions,"101 Kenny Street Wollongong, NSW 2500 PO Box 1583 Wollongong, NSW 2500"
Logistics & Convenience,"7-1-3 Doicho, Amagasaki-shi, Hyogo 660-0083"
Transmetrics AI,"33 Shar Planina Str. 1303, Sofia, Bulgaria"
Transmetrics AI,"Joop Geesinkweg 901 1114AB Amsterdam, The Netherlands"
Transmetrics,NAGPUR - 440022 INDIA
RAMINFO,"3-225/SH/401, 3rd Floor, Sterling Heights Mahindra Mind Space, Kavuri Hills, GB PET Phase 2 Road, Hyderabad - 500 033."
Sakura,"1 Chikkoyawatamachi, Sakai-ku, Sakai-shi, 590-0901 Nippon Steel Co., Ltd. Shaped Steel Center 2F"
Sakura,"2-11 Takasago, Takaishi City, 592-0001"
Sakura,"3 Shinminato-cho, Izumiotsu-shi, 595-0073"
Sakura,"1555-16 Hamada, Aboshi-ku, Himeji 671-1242"
Sakura,"1-21-22 Jusohonmachi, Yodogawa-ku, Osaka 532-0024 (Sakura Building)"
Sakura,"3-1 Hikarigaoka, Hikari City, Yamaguchi Prefecture 743-0023 (203 in the Software Center)"
ValTech,"6-22-1 Nishi-Shinjuku, Shinjuku-ku, Tokyo Shinjuku Square Tower 3rd floor"
ValTech,"23145 New Taipei City New Store, Alley, Lane 45, 8 tampering, 5th Floor, No. 5"
QTCPlus,"1660, Hope Drive, Santa Clara, California 95054, US"
QTCPlus,"F502, Country Park,  Dattapada Road, Borivali (E), Mumbai, Maharashtra 400066, IN"
QTCPlus,"Swancreek CRT, Brampton, Toronto, Ontario L6W 3W8, CA"
QTCPlus,"L29, 2nd A Main, Sector 6, HSR Layout, Bengaluru, Karnataka, 560102 IN"
Trimble Mobility Solutions India,"VIKRAM MONARCH, 10th floor, CTS no 1115.A/1, Ganeshkhind Road,Shivaji Nagar, Pune 411016 Maharashtra,India."
Trimble Mobility Solutions India,"UNITECH CREST, Greenwood City, Sec-45, Blk-C, Ground FloorGurgaon 122003, Haryana"
Trimble Mobility Solutions India,"A North, 9th Floor, Tidel Park, No. 4 Rajiv Gandhi Salai, Taramani, Chennai 600113, Tamil Nadu"
Trimble Mobility Solutions India,"# 43, 1st floor, 2nd stage, BHCS layout, Vijayanagar 2nd stage, Bengaluru 560040 Karnataka"
Trimble Mobility Solutions India,"Shree Sawan Knowledge Park, 4th Floor, D 507, TTC Industrial Area, M.I.D.C., Turbhe Navi Mumbai 400705, Maharashtra"
KYOEI SYSTEM,"1-15-7 Awaza, Nishi-ku, Osaka-shi, Osaka"
KYOEI SYSTEM,"〒134-0088 6-12-8 Nishikasai, Edogawa-ku, Tokyo JAWA BLD 601"
Visichain,"UNIT 1104 11/F CRAWFORD HOUSE 70 QUEEN'S ROAD CENTRAL, CENTRAL HONG KONG S.A.R."
Hitachi Distribution Software,"Toyo MK Building, 7-2-14 Toyo, Koto-ku, Tokyo 135-0016"
Hitachi Distribution Software,"6-11 Minami 1 Jonishi, Chuo-ku, Sapporo, Hokkaido 060-0061 Sapporo Hokushin Building"
Hitachi Distribution Software,"2364-1 Motokomezaki, Naka City, Ibaraki Prefecture 311-0101"
Hitachi Distribution Software,"2-14-21 Nishiki, Naka-ku, Nagoya-shi, Aichi 460-0003 Maruyama Nissei Building"
Hitachi Distribution Software,"1-27-12 Nishikujo, Konohana-ku, Osaka-shi, Osaka 554-0012 Hitachi Logistics No. 2 Building"
Hitachi Distribution Software,"2-2-7 Kyutaromachi, Chuo-ku, Osaka-shi, Osaka 541-0056 Yamaguchi Kosan Sakaisuji Building"
Hitachi Distribution Software,"Hakata Ekimae C-9 Building, 4-2-20 Hakata Ekimae, Hakata-ku, Fukuoka 812-0011, Fukuoka Prefecture"
Hitachi Distribution Software,"2-9-28 Hakata Ekimae, Hakata-ku, Fukuoka 812-0011, Fukuoka Prefecture, Fukuoka Chamber of Commerce Building 8F"
Track Company Bus,"Trivandrum Vizhinjam Road, Kamaleshwaram, Thiruvananthapuram-695009, Kerala, India"
Technorip Innovations Pvt Ltd,"Vithayathil House, KunnukaraN. Aduvassery, S. Aduvassery P.O. Aluva, ERNAKULAM, INDIA 683578"
T3EX Global Holdings,"12F., No.563, Sec. 4, Zhongxiao E. Rd., Xinyi Dist., Taipei City"
T3EX Global Holdings,"	6F M2 Building 2-8-1 Tanimachi Chuo-ku, Osaka Japan 5400012"
T3EX Global Holdings,"	7F, Shinsendo BLDG 2-15-15, Nihonbashi Ningyocho, Chuo-ku, Tokyo Japan 103-0013"
T3EX Global Holdings,"	B-707 Kangseo Hangang XII Tower, Yangcheon-ro, Kangseo-ku, Seoul, S.Korea"
T3EX Global Holdings,"2F, No.43, Keda 1st Rd., Zhubei City, Hsinchu County 302, Taiwan (R.O.C.)"
T3EX Global Holdings,"Room 3, 5th floor, No.14, Gingchen Road, Taichung, Taiwan, R.O.C."
T3EX Global Holdings,"	Rm. B, 23F., No.29, Haibian Rd., Lingya Dist., Kaohsiung City 802, Taiwan （R.O.C.）"
T3EX Global Holdings,"	Rm.D, 8F.,No.263, Siwei 3th Rd., Lingya Dist., Kaohsiung City 802, Taiwan"
T3EX Global Holdings,"3F, No. 16, Section 1, Nánjīng East Rd, Jhongshan District Taipei City, Taiwan 104"
T3EX Global Holdings,"1F,No.982,Sec.2,Huanzhong Rd., Xitun Dist., Taichung City 407, Taiwan"
T3EX Global Holdings,"	5B51,5F,No.8-1, Hangqin N. Rd., Dayuan Township, Taoyuan County 337, Taiwan (R.O.C.)"
T3EX Global Holdings,"	3F,No.16, Sec. 1, Nanjing E. Rd., Zhongshan Dist., Taipei City 104, Taiwan"
T3EX Global Holdings,"	7F., No.6, Housheng Rd., Luzhu Dist., Taoyuan City 33855, Taiwan"
T3EX Global Holdings,"807, 8F, No. 6, Lìxíng 6th Rd, Dong District Hsinchu City, Taiwan 300"
T3EX Global Holdings,"	409 N. Oak Street, Inglewood, Ca 90302, USA"
T3EX Global Holdings,"	67-16 146th Ave, Jamaica, NY11434, USA"
T3EX Global Holdings,"	2/22 Iyara Tower, 6th Fl., Unit 603,Chan Rd., Thungwatdon, Sathorn, Bangkok 10120"
T3EX Global Holdings,"	Room 3FA ,Vtrust Office Center, St. 109, Sangkat Mittapheap, Khan 7 Makara, Phnom Penh, Cambodia"
T3EX Global Holdings,"	11F, No.201-203 Cach Mang Thang Tam St., Ward 4, Dist 3, Ho Chi Minh city, Viet Nam"
T3EX Global Holdings,"	RM509B, 5F, TD Business Center Tower, No. 20, Le Hong Phong St., Ngo Quyen Dist., Hai Phong, Vietnam"
T3EX Global Holdings,"	5 Floor, Thanh Loi Building, 249 Nguyen Van Linh St. Vinh Trung Ward, Thanh Khe Dist, Da Nang City, Vietnam 550000"
T3EX Global Holdings,"5 Floor, Dao Duy Anh Tower. No. 9, Dao Duy Anh, Dong Da, Hanoi, Vietnam"
T3EX Global Holdings,"Unit 1605, 16/F, Ayala Tower One, Ayala Ave., Makati City Philippines 1226"
T3EX Global Holdings,"13-2, Jalan Mahogani 5/KS7, Bandar Botanic, 41200 Selangor Darul Ehsan, Malaysia"
T3EX Global Holdings,"	163E, Level 16, Hunza Tower Gurney Paragon, Jalan Kelawei, Georgetown, 10250 Penang, Malaysia"
T3EX Global Holdings,115 Airport Cargo Road Changi Airfreight Centre Cargo Agents Bldg C #06-19 Singapore 819466
T3EX Global Holdings,119 Airport Cargo Road#01-01/02 changi Cargo Agents Megaplex 1 Singapore
T3EX Global Holdings,"Ruko Mega Grosir Cempaka Mas Blok P No. 6 Jl. Letjen Suprapto, Jakarta 10640, Indonesia"
T3EX Global Holdings,"	Room109,No.34, Development Zone, Nangang District Harbin, Heilongjiang,China 150000"
T3EX Global Holdings,"	ROOM2402，China Life Insurance Mansion，NO.26 Renmin Road，Zhongshan DIST，Dalian China"
T3EX Global Holdings,"	Room 1007,International Trade Building,No.35,Qingnian Street , Shenhe District, Shenyang, Liaoning P.R. China"
T3EX Global Holdings,"	Suite 808, No. 189, The Exchange Tower 1, Nanjing Road, Tianjin 300051, China"
T3EX Global Holdings,"Room 706, Building C, Hangcheng Plaza, No.2 ,Jinsui Road, Shunyi district, Beijing"
T3EX Global Holdings,"	Room 1510, Rongding Building, No. 226 Zhonghua North Avenue, Xinhua District, Shijiazhuang, Hebei, China, 050000"
T3EX Global Holdings,"	Floor 22, Block 1, Software Park, No. 288, Ningxia Road, Shinan District, Qingdao, Shandong, China 266071"
T3EX Global Holdings,"	Rm1218 Shandong International Trade Building No.51 Taiping Road,Qingdao,China 266001"
T3EX Global Holdings,"	29 Floor, E-Tong International Tower,No.11 South Avenue, Yantai, Shandong Province, P.R. China ( 264000)"
T3EX Global Holdings,"	Room. 1612 Block A, XinShiJie Building, No.49-1 ShuangTa West Street, Yingze District, Taiyuan City, Shanxi Province, P. R. China 030001"
T3EX Global Holdings,"	Room 2207-2210, Floor 22, Unit 2, Building 2, 88 Jinshui East Road, Zhengdong New District, Zhengzhou city, Henan Province, P. R. China (450000)"
T3EX Global Holdings,"	Room 2106, 21st Floor, Building 1, Shaanxi International Convention and Exhibition Building, No. 1 Chang'an North Road, Beilin District, Xi'an city, Shaanxi Province, P. R. China"
T3EX Global Holdings,"	Room 916, 13/F, NO.2 Building, No.27 Qinglong Street, Qingyang District, Chengdu, P.R. China 610000"
T3EX Global Holdings,"8 Qixia Road, Liangjiang New Area, 16 buildings 11-9 in the era of Jinmao, Chongqing Province, P. R. China 401120"
T3EX Global Holdings,"	RM7005, JinCheng Building, NO.436, Middle Changjiang Road, HeFei, AnHui Province, China"
T3EX Global Holdings,"	Room 1501, Level 15, Shipping International Plaza, NO.250 Jianghan Road, JiangAn District, Wuhan,P.R. China 430014"
T3EX Global Holdings,"	1502, No.1.Boulevard2 Wu Yi Road(west), FuRong District,ChangSha, Hunan, China 410005"
T3EX Global Holdings,"Room 1208, Wall Street Plaza ,1669 Honggu Central Avenue, Honggutan District, Nanchang, Jiangxi, China (330038)"
T3EX Global Holdings,"	No.189 Huo Ju Street, Gao Xin Developmant Zone, Nanchang City, Jiang Xi Province, China"
T3EX Global Holdings,"8FL, Rm803-805, xiamen top plaza, No.2, Lujiang Road, Xiamen, China 361001"
T3EX Global Holdings,"Room 719, 14th Floor, South Building, Huacheng International Building, No. 162, Wusi Road, Fuzhou, China 350003"
T3EX Global Holdings,"Room P, 19th floor, Commercial Building, Flat B Zhongken Plaza, No.18 Anlan Road., Zhongshan, Guangdong Province, P.R.China 528402"
T3EX Global Holdings,"Room.1505-06, Eastern Tower,THE Plaza, No.625 Tianhe Road, Guangzhou, China"
T3EX Global Holdings,"Room.1507, Eastern Tower,THE Plaza, No.625 Tianhe Road, Guangzhou, China"
T3EX Global Holdings,"A2, 23/F, Block A, Nanfang Securities Building, No.2018 Jianshe Road, Luohu, Shenzhen, P. R. China (518001)"
T3EX Global Holdings,"F35, 4th Floor, Podium Building, Huangcheng Plaza, No. 7 Futian South Road, Futian District, Shenzhen"
T3EX Global Holdings,"13005E-13006E,13/F., ATL Logistics Centre B, Berth 3, Kwai Chung Container Terminal, Kwai Chung, N.T."
T3EX Global Holdings,"Rm601-7,Prosperity Millennia Plaza, 663 King's Rd.,Quarry Bay,HK."
T3EX Global Holdings,"Block G, 3/F & G/F G1 & Block H, G/ F, Yiu Lian Dockyard Ltd., 1-7 Sai Tso Wan Road, Tsing Yi, H.K."
T3EX Global Holdings,"Tai Hing Industrial Building, 3 Tsing Yeung Circuit, Tuen Mun, New Territories, Hong Kong"
T3EX Global Holdings,"Block H, Ground Floor, Yiu Lian Dockyard, 1-7 Sai Tso Wan Road, Tsing Yi, Hong Kong"
T3EX Global Holdings,"1103 Dongnan Building ,No. 258, Changle Road, Jiangdong District of the East New Town, Ningbo, Zhejiang Province, P.R.China 315040"
T3EX Global Holdings,"Room 908，CaiFu Place ，No527 West ZhongShan Road, XiuZhou District，JiaXing City，PRC 314031"
T3EX Global Holdings,"Room 528, Block B, Yiwu Port, NO.266, Chengxin Ave, Yiwu, Zhejiang, Province, China (322100)"
T3EX Global Holdings,"Room 508-1, Building B, Ocean International Center, No. 355, Jinhua South Road, Gongshu District, Hangzhou, Zhejiang, China 310005"
T3EX Global Holdings,"Room 1107 Dongnan Building ,No. 258, ChangLe Road, Jiangdong District of the East New Town,Ningbo City,Zhejiang Province, P.R.China 315040"
T3EX Global Holdings,"D2,2.Section, First Bonded Warehouse, First Hai Tian Road, Pudong, Shanghai City, 201202, China"
T3EX Global Holdings,"11F, Kaikai Plaza, No 888 Wanhangdu Road, Jinan District, Shanghai, 200042"
T3EX Global Holdings,"Rm.803,8F，Changhui building.,No.799,yin xiang road,Shanghai,P.R.China 201802"
T3EX Global Holdings,"No.536, Shenglong Road, Songjiang District, Shanghai"
T3EX Global Holdings,"Level 3,No.1439, Haixu Road, Shanghai, China (200137)"
T3EX Global Holdings,"Room 203, No.1 building, No21 Jinwen Road, Pudong New District, Shanghai"
T3EX Global Holdings,"Room 5F/Room F2, No.61 YangShuPu Road, Shanghai, P.R. China 200082"
T3EX Global Holdings,"10F, Kaikai Plaza, No 888 Wanhangdu Road, Jinan District, Shanghai, 200042"
T3EX Global Holdings," 	Room 327,Heji Plaza, No.666 East Ganjiang Road, Suzhou, Jiangsu Province, P.R.China 215005"
T3EX Global Holdings,"	Room 909, No.99 Changjiang Road, Nanjing, P. R. China 210005"
T3EX Global Holdings,"	Room 513, Area B, Daluqiao International Business Mansion, No.188 North Haitang Road,Lianyungang City P.R.China"
T3EX Global Holdings,"	Room J, 26th Floor, Block A, DongFang Plaza, No.343 Zhongshan Road, Cong'an District, Wuxi City, Jiangsu Province, P.R.China 214000"
Casfer Technologies,HNO 194-B FADTEWADDO VERODA CUNCOLIM SALCETE GOA MARGAO GA 403703 IN
Prophit Systems,"PO Box 213, Balgowlah NSW 2093, Australia"
Prophit Systems,"3333 Piedmont Road, Suite 2050, Atlanta, Georgia 30305, US"
Prophit Systems,"Level 29 Tower 1 Shanghai Jing An Kerry Centre, 1515 Nanjing West Road, Jing An District, Shanghai, CN"
Prophit Systems,"57 Mohamed Sultan Road, Singapore , 23, SG"
KSL Logistics,"3/4 R P garden Sahibabad Ghaziabad, Uttar Pradesh, 201005,"
KSL Logistics,"Gurgaon Road, Gurgaon, Haryana 122017, IN"
Raygain,"133, Ist Floor, Somdutt Chamber-1 5, Bhikaji Cama Place, New Delhi-110066."
Raygain,"8801 Independence Ave Unit#13,, Canoga Park, CA, USA, -Zip -91304, California, California 91304, US"
Raygain,"10, Headington Place, Mill Street, Slough,, Berkshire SL2 5EL, UK, Berkshire SL2 5EL, GB"
Raygain,"17 , Kungumam Nagar, Porur , Chennai -600116, Chennai, Chennai 600116, IN"
Raygain,"119, Genting Lane, Singapore - 349570, Singapore, Singapore 349570, SG"
Original Soft,"3-2-1 Nishi-Shimbashi, Minato-ku, Tokyo 105-0003 Daiwa Nishi-Shimbashi Building 8F"
Usac System,"4F, International Hakozaki Building, 4-3 Nihonbashi Hakozaki-cho, Chuo-ku, Tokyo"
Usac System,"1-6-10 Kawaramachi, Chuo-ku, Osaka 541-0048 JP Building 3F"
100M Intelligent,"Unit 33-36, 5th Floor, Building 5, No. 2, Kejiyuan Road, Baiyang Street, Hangzhou Economic and Technological Development Zone"
Transfocus,"Suite 2, 129 Greenhill Road Parkside  SA  5063"
UniGPS Solutions,"#1353, A-Square, BCCHS Layout, Sir M. Visvesvaraya Square,, Near Holiday Village Resort, Off Kanakapura Road, Bengaluru, Karnataka 560062"
UniGPS Solutions,"#310, Megha Center,Pune Solapur Road Hadpsar, Pune 411013"
UniGPS Solutions,"#50, Near Tappsya Convent,Vinkar Colony,Manewada Square Nagpur 440024"
