username,date,variation,rating,comment
chutima_s,2018-07-13 19:06:27,,2,เหล็กไม่แข็งแรงเลยค่ะ แกะห่อออกมาก็เบี้ยวแล้ว และตามข้อต่อมีรอยไม่สวยงาม ควรปรับปรุงคุณภาพสินค้าหน่อยนะคะ คุณภาพของสินค้าแย่ ความคุ้มค่าแย่
kookkiktapaneejaidee,2020-08-06 18:57:52,,4,ดีค่ะ ตรงปกค่ะ  ชอบ ๆๆฟฟๆๆๆๆๆไไถูกดีค่ะ  แขวนผ้าพอดีเลยค่ะชอบ     ถูกใจ   ๆๆๆๆๆๆๆๆๆๆๆๆๆๆๆๆสวยๆๆๆๆๆๆๆๆๆดีค่ สังอีกแน่นอน
chotranajindatragoon,2020-09-08 22:33:55,,4,"ประกอบง่าย เรื่องความแข็งแรงยังไม่ได้ลองใช้ ราคาถูก จัดส่งดี
​"
j*****3,2020-07-03 18:19:07,,5,
tharanpat28,2018-10-13 07:18:27,,5, คุณภาพของสินค้าดีมาก ความรวดเร็วในการจัดส่งดีมาก การให้บริการจากร้านค้าดีมาก การให้บริการจากบริษัทขนส่งดีมาก
kamonwanthangmee,2018-11-02 12:43:41,,4, ความคุ้มค่าดี ความรวดเร็วในการจัดส่งดี การให้บริการจากบริษัทขนส่งดี
wanus.tony,2019-10-08 23:27:26,,1,ล็อคแน่นชิบหาย เสียเงินฟรีๆ
zgamenonsense90,2018-10-29 19:34:05,,2," ความรวดเร็วในการจัดส่งดีมาก การให้บริการจากร้านค้าดีมาก การให้บริการจากบริษัทขนส่งดีมาก คุณภาพของสินค้าแย่ ความคุ้มค่าแย่
สินค้าไม่ได้ฉาก,เหล็กบางมาก"
pacharaphathklab,2019-10-13 10:01:27,,4,พอใช้ตามราคา แข็งแรงระดับนึง แต่ค่อนค่างเกิดสนิมง่ายเป็นจุดๆ
beebee25356,2018-12-17 17:29:17,,4,มีตินิดนึงคือมันยกขึ้นลำบากเหมือนเหล็กเบี้ยว แต่โดยรวมโอเครคะ
choltisaprasert,2020-07-10 22:41:01,,5,"สิ้นค้าชำรุดแม่ค้ารับผิดชอบคืนเงินให้ค่ะ
บริการดีมากค่ะ
"
supanneepangsuwan,2020-03-26 13:33:39,,3,ได้รับของไวคะ​ แต่มีสนิมหลายจุดเลย​ ไม่ค่อยโอเคเท่าไหร่คะ​แอบผิดหวัง
mint.sattarsat,2020-02-27 22:07:30,,5,คุ้มค่ามากค่ะ. แอบลุ้นว่าจะเบี้ยวจะงอมั้ย แต่ก็ไม่ค่ะ  
pornsiringamsirikul,2020-07-11 03:11:48,,5,
thitikul21,2019-07-13 14:06:12,,5,
thidav,2019-10-12 03:45:00,,5,
bum.mattana,2019-12-13 15:45:11,,5,
gybzyleo,2020-05-25 14:48:30,,5,
nattaporn3737,2020-12-15 09:50:20,,5,
tidam,2019-05-25 09:30:02,,5,
friendly_minniemouse,2020-03-25 01:37:33,,5,
miwnavarat,2019-06-04 13:49:31,,4,เหมือนในรูปภาพ ห่อกันกระแทกให้ด้วย ขาเอียงนิดหน่อยหัก1ดาว
thailandwin,2019-12-12 16:59:45,,5,
s*****h,2020-04-09 09:42:14,,5,
out.9096,2020-01-19 23:46:57,,4,ภาพรวมของสินค้าเทียบกับราคาแล้วถือว่าดีมากเลยค่ะ คุ้มค่า
zppream,2018-07-03 18:34:47,,4, คุณภาพของสินค้าดี ความคุ้มค่าดี ความรวดเร็วในการจัดส่งดี
dabdookdanuphatsonthip,2019-10-27 22:28:28,,4,ก็โอเครอยู่
kidnewrnyu,2020-04-08 12:45:51,,5,
mod_ntm,2020-05-14 17:54:06,,5,
jureerats,2018-09-19 07:22:20,,4, คุณภาพของสินค้าดี ความคุ้มค่าดี ความรวดเร็วในการจัดส่งดี
n*****d,2020-07-13 19:45:33,,5,ดีค่ะ สินค้าจัดส่งดีมาก พนักงานสุภาพมาก ดีๆๆๆๆๆ เหมือนร้านนี้จะถูกกว่าร้านอื่นๆที่ไปค้นๆมาด้วยมั้ง โดยรวมโอเค 
nipapornprrompapan,2018-08-28 16:31:59,,5, ความคุ้มค่าดีมาก ความรวดเร็วในการจัดส่งดีมาก การให้บริการจากร้านค้าดีมาก การให้บริการจากบริษัทขนส่งดีมาก คุณภาพของสินค้าดีมาก
pee005,2019-02-09 17:02:51,,4,สวยแระดี
zanikamee,2019-10-13 17:47:10,,1,มีสนิมขึ้นที่สินค้า และบุบยุบบ
s*****5,2020-07-10 22:20:27,,5,สินค้าคุณภาพโอเค เหมาะสมกับราคา ประกอบไม่ยากแนะนำค่ะ
ben_bj,2020-04-14 10:34:13,,4,สินค้าเบี้ยว ไม่ตรง ทำให้เวลาตั้งขาลอยข้างนึก หัก1ดาว
since1987_kuntiya,2018-06-12 13:36:10,,3, ความคุ้มค่าพอใช้ ความคุ้มค่าพอใช้ การให้บริการจากบริษัทขนส่งพอใช้
suthathip_2929,2020-05-27 11:18:27,,5,
tanagonpratas,2020-02-11 20:55:11,,3,ส่งใว แพ็คดี แต่วัสดุบอบบางมากๆ ขันน๊อตแรงก็น๊อตล๊อคก็จะหลุด
permpoon2298,2018-09-04 22:40:04,,5, คุณภาพของสินค้าดีมาก ความคุ้มค่าดีมาก ความรวดเร็วในการจัดส่งดีมาก การให้บริการจากบริษัทขนส่งดีมาก
ploybudsayarin,2021-02-07 12:38:08,,4,สินค้าโอเคค่ะ เเต่ว่าอาจจะดูบอบบางไปนิดนึงแต่รวมๆโอเคค่าา จัดส่งเร็วมากๆ 
suprompitak,2020-08-07 14:15:55,,5,แข็งแรงและส่งเร็วมากครับ
juthamaneesuwannapoom,2020-06-23 12:11:04,,1,ราวโยกเยก และตัวเชื่อมข้างในเสาราวมีเหล็กหยดมาคั่นไว้ทำให้ใส่เข้าไปได้ไม่สุด
jiira,2018-11-07 17:56:49,,4, คุณภาพของสินค้าดี ความคุ้มค่าดี ความรวดเร็วในการจัดส่งดี
suphat28,2018-09-20 22:01:24,,4, การให้บริการจากบริษัทขนส่งดี คุณภาพของสินค้าสมราคา
desserttime_cnx,2019-06-26 10:12:27,,4,
asamaaeloh,2020-03-06 13:59:39,,4,
,2018-04-20 14:12:54,,4,โดยราคาคุณภาพสมเหตุสมผลแล้วแต่ที่ไม่ได้ 5 คะแนนเป็นเพราะไม่เข้าใจการออกแบบของเขาว่ามีน็อตให้แต่ไม่มีรูเจาะให้น็อตลงก็เลยคิดได้แค่ใช้น็อตเป็นตัวกั้นแทนที่จะใช้เป็นตัวยึด  ซึ่งก็ทำให้การยึดตัวของสินค้าไม่ดีเท่าที่ควร  มองยังไงก็ไม่รู้จะประกอบขึ้นรูปได้แตกต่างจากนี้ได้ยังไงอีก บริการทุกอย่างดีมากค่ะ
pimnrsm,2021-02-03 07:47:22,,5,สินค้าโอเคไม่จกตา ชอบการแพ็คของทางร้านแน่นหนามาก บริการจัดส่งไว สินค้ารับน้ำหนักผ้าดีมาก แถมยังประกอบง่ายอีก ไม่ผิดหวังกับร้านนี้จริงๆค่ะ เอา5ดาวไปเลย
jitnapablookwah,2020-07-15 11:03:32,,4,
taepatchakorn,2019-08-06 23:28:24,,4,
bellezza_mar,2018-09-03 14:43:11,,5, คุณภาพของสินค้าดีมาก ความคุ้มค่าดีมาก
sawitchayachanidapapong,2018-09-25 17:47:15,,5, คุณภาพของสินค้าดีมาก ความคุ้มค่าดีมาก ความรวดเร็วในการจัดส่งดีมาก การให้บริการจากร้านค้าดีมาก
jiewumaporn,2018-09-16 22:31:17,,3,ส่งมาถึงเป็นรอยลอกแล้วเคลือบไว้บางมาก   ความคุ้มค่าพอใช้
thanason07,2020-05-15 17:33:11,,5,
yuwadeeonburee,2018-11-06 12:52:14,,5, คุณภาพของสินค้าดีมาก ความคุ้มค่าดีมาก ความรวดเร็วในการจัดส่งดีมาก การให้บริการจากร้านค้าดีมาก
m*****7,2020-06-06 11:34:10,,5,
ashitaamornsin,2018-10-24 10:34:58,,3,ส่งเร็วก็จริงครับแต่สินค้ามีตำหนิแต่ก็ตามราคาน่ะครับ
adireknote,2020-06-05 19:34:10,,4,แพคสินค้าดี แต่ตรงขาอ่อนไปหน่อย เหมือนจะหัก
fishbooboofish,2018-09-12 23:20:58,,3, คุณภาพของสินค้าพอใช้ งานเชื่อมไม่ค่อยเนียน  การให้บริการจากบริษัทขนส่งควรปรับปรุง พนักงานแสดงสีหน้าไม่ค่อยดี
ch.chuemchit,2020-05-07 18:49:58,,5,"ควรจะส่ง บ. อื่นครับ DHL ช้าเกินไปครับ
ขึ้นกำลังจัดส่งตั้งแต่วันที่ 4 ส่งจริงวันที่ 7 "
kittijit,2020-05-09 21:04:03,,2,เป็นสนิม
annegiff,2018-07-03 18:51:10,,3, คุณภาพของสินค้าพอใช้ น๊อตที่เชื่อมล็อคราวหลุด
maeigang1,2019-05-23 21:12:32,,3,ประกอบออกมาแล้วขาราวไม่เท่ากัน  ลอยเยอะมาก ต้องปรับแต่งดัดเอา พอได้ ร้านพ็คของมาอย่างดี จัดส่งไวมากค่ะ
0884523883jan,2020-05-14 22:12:34,,4,สินค้ามาถึงเร็ว คุณภาพพอใช้ได้ ติดตั้งง่าย น.น.เบา มีรอยบุบนิดเดียว
b*****n,2021-01-23 23:58:17,,5,"แข็งแรงดีค่ะ เหมาะสมกับราคา
แข็งแรงดีค่ะ เหมาะสมกับราคา
แข็งแรงดีค่ะ เหมาะสมกับราคา
"
,2018-07-06 15:41:39,,5, คุณภาพของสินค้าดีมาก ความคุ้มค่าดีมาก ความรวดเร็วในการจัดส่งดีมาก การให้บริการจากร้านค้าดีมาก การให้บริการจากบริษัทขนส่งดีมาก
lookingforclothes_justnachi,2020-03-26 13:49:06,,1,พังง่ายมาก เหล็กก็เชื่อมไม่ดีเลย สัปดาห์เดียวก็คือพังละ
polokapolo,2019-01-17 19:30:40,,5,การจัดส่งไวมากๆ มีการห่อสินค้ามาอย่างดีเยี่ยม สินค้าใหม่ไม่มีตำหนิเลยค่ะ 
fahsai_42,2019-12-12 13:54:42,,5,ส่งเร็ว ห่อมาดีค่ะ
pilaisaetang,2019-12-25 11:06:09,,2,"สินค้าไม่แข็งแรงตามราคา140 
ไม่แนะนำให้แขวนเสื้อผ้าทีหนักเพราะ จะทำให้ราวเอียงและพัง เพราะลองทำปล้วคะ😂"
natthanarta.tranahttan,2018-09-21 23:23:46,,5, คุณภาพของสินค้าดีมาก ความคุ้มค่าดีมาก ความรวดเร็วในการจัดส่งดีมาก การให้บริการจากร้านค้าดีมาก การให้บริการจากบริษัทขนส่งดีมาก
new_uknow96,2018-11-27 13:11:33,,4,ตอบไวมาก คุณภาพของสินค้าดี ความรวดเร็วในการจัดส่งดีมาก การให้บริการจากร้านค้าดี
uraiwanpimpo,2018-09-18 14:18:52,,5, คุณภาพของสินค้าดีมาก ความรวดเร็วในการจัดส่งดีมาก การให้บริการจากบริษัทขนส่งดีมาก
banana_home11,2020-09-13 23:52:14,,3,เหล็กงอ ค่ะ ไม่รู้เป็นเพราะการขนส่งหรือเพราะทางร้านไม่ตรวจสินค้านะคะ เข้าใจค่ะ ตามราคาตามสภาพ 
wichienprommachai,2020-04-08 19:10:50,,4,ขอหักหนึ่งดาวเนื่องจาก มีรอยยุบที่ขา และขาตั้งไม่ไดระดับ ต้องมาดัดให้เสมอกันอีกรอบ
zaahzaa,2020-03-05 11:19:56,,4,คุณภาพพอใช้แพ๊คสินค้าดีมาก
newty_ph,2019-05-23 16:46:37,,3,เหล็กบางไปหน่อยค่ะ ซื้อมา3 อันขาหักไป1 ค่ะ แต่คุณภาพก็สมราคาค่ะ พอใจในระดับนึงค่ะ 
aoytanaporn,2019-06-08 14:25:58,,4,คุณภาพโอเคกับราคานี้
time4toy,2018-08-24 17:19:51,,5, คุณภาพของสินค้าดีมาก ความคุ้มค่าดีมาก ความรวดเร็วในการจัดส่งดีมาก
golffer246,2020-01-23 19:38:59,,3,เบาบาง มีสนิม แพ็กเกจจิ้งพอใช้
mengwt.,2019-12-05 11:02:10,,5,ส่งเร็วครับ​ คุณภาพเหมาะสมกับราคาเยี่ยมครับเอาไป5ดาวว
wantipa39,2018-10-11 12:48:58,,5, ความคุ้มค่าดีมาก ความคุ้มค่าดีมาก ความรวดเร็วในการจัดส่งดีมาก
mintaaaaaaaa,2018-11-13 19:23:50,,5,ห่อสินค้าได้แน่นหนามาก งานคุณภาพ ทักถามตอบเร็วดีค่ะ ไม่เสียดายที่ซื้อ
ratchani.34,2018-09-11 20:45:44,,4, ความคุ้มค่าดี ความรวดเร็วในการจัดส่งดี  การให้บริการจากบริษัทขนส่งดี 
onumasamroutwong,2018-09-12 08:16:27,,4, คุณภาพของสินค้าดี ความรวดเร็วในการจัดส่งดี การให้บริการจากบริษัทขนส่งดี
ratchanee11102543,2020-02-28 12:16:19,,4,เเข็งเเรงดีค่ะ
winniethepooh82,2019-02-22 16:55:47,,1,แขวนชุดได้แค่10 กว่าชุด หักเลยจร้า ตรงรอยต่อเชื่อมมาไม่ดีเลย สั่งมา 4 ใช้ได้แค่2 นอกนั้นหักหมด
patcharee161240,2018-12-18 18:34:05,,1,สินค้าแย่มากค่ะ เหมือนเอามือสองมาให้
thefamousonly,2020-04-30 19:17:55,,5,ส่งของไวค่ะ
kkachamat,2020-03-02 21:41:13,,5,ถือว่าไม่แย่นะคะในราคาเท่านี้ ดูแข็งแรงดีค่ะ ขนส่งก็เร็วดี
s*****e,2021-01-10 14:43:31,,5,ทางร้านห่อสินค้ามาดีมากค่ะ ประทับใจมาก มีโอกาสจะกลับมาอุดหนุนอีกแน่นอนค่ะ 
jeabjeub,2018-09-28 17:34:30,,4,คุ้มค้าค่ะแต่หักหนึ่งดาวเพราะมีสนิมเกาะค่ะโดนรวมถือว่าโอเครค่ะ
noofangwiravan,2018-09-06 20:08:01,,5, ความรวดเร็วในการจัดส่งดีมาก การให้บริการจากบริษัทขนส่งดีมาก
i*****s,2020-04-27 12:35:02,,5,สินค้าแพ็คมาหนาแน่นดีมาก จัดส่งรวดเร็ว
fern17032537_88888.,2019-06-03 18:17:18,,4,"สินค้าดี เหมาะสมกับราคา
รับน้ำหนักได้พอประมาณ...
บริการส่งรวดเร็ว"
ahitler1911,2018-11-22 13:06:49,,4, คุณภาพของสินค้าดี ความคุ้มค่าดี ความรวดเร็วในการจัดส่งดีมาก การให้บริการจากบริษัทขนส่งดีมาก การให้บริการจากร้านค้าดี
nitarr246,2020-04-28 13:32:51,,4,ราวตากผ้าขนาดกำลังดี​ ประกอบง่าย​ แต่เสาอีกข้างมันเอียงๆค่ะ​ 
najwa.2540,2020-08-13 20:55:24,,5,
nongni8022,2020-06-01 17:10:30,,2,ค่าเหล็กมาก็ไม่เท่ากัน ต้องมาดัดเองให้มันลง ถึงจะตั้งได้ รวมๆแล้วก็พอได้กับราคา
fainuna,2019-09-11 19:59:38,,4,สินค้าส่ง 3 วันถึง นับจากวันที่ส่ง คุณภาพดีค่ะ สามารถใช้งานได้
1204.2521,2019-10-06 17:15:49,,1,"แกะออกหักหมดเลยใช้ไม่ได้..ต้องไปจ้างเค้าเชื่อมอีก100กว่าบาท แพคสินค้าแน่นไปป่ะ บีบแน่นจนมันหัก
"
jirapronfonchuenlom,2019-05-29 17:39:12,,5,"ภูมิใจมาก ได้สินค้าตรงสเปก ไม่บุบๆ เบี้ยวๆ 
ประกอบเอง ง่ายสุดๆ "
sirikornmiew,2020-03-28 21:53:05,,3,มีรอยค่ะ โดยรวมโอเค
rattanapornpromjai,2020-01-06 15:18:48,,5,
trinnity,2020-08-13 16:03:10,,5,
chaiwat.benten,2019-05-29 14:04:43,,5,
jaohyuna,2020-06-07 03:22:18,,5,
thadapond,2020-05-12 17:54:30,,4,แข็งแรงดี
082_2194206,2018-11-21 01:33:19,,4, คุณภาพของสินค้าดี ความคุ้มค่าดี ความรวดเร็วในการจัดส่งดี
b*****a,2020-05-22 21:02:00,,2,สินค้าแพคมาดีคุณภาพของสินค้าตามราคา
earnccdp,2019-10-01 19:32:19,,5,สินค้าคุณภาพดีค่ะ แข็งแรงต่อง่ายไม่ต้องใช้เครื่องมือเลยค่ะ สินค้าได้เร็ว ชอบค่ะ 🙌
somphonhempha,2020-01-29 11:49:00,,4,ถูกใจมากกกกกกกกกกกกกกกกกกกกกกกกกกกกกกกกกกกกกกกกกกกกกกกกกกกกกกกกกกกกกกกดดดดดดดดกกกกกกกกกกกกกกกกกกกกกกกกกกกกกกกกกกกกกกกกกกกกกกกกกกกกกกกกกกกกกกกกกกกกกกกกกกกกกกกกกกกกกกกกกกกกกกกกกกกกกกกกกกกกกกกกกกกกกกกกกกกกกกกกกดดดกก
jjustmiimee,2019-07-28 11:40:21,,4,โครงเหล็กยังไม่แข็งแรงเท่าที่ควร แต่โดยรวมก็ใช้ได้อยู่ค่ะ 
yuwarinsiragur,2018-06-13 21:15:10,,4, คุณภาพของสินค้าดี ความคุ้มค่าดี ความรวดเร็วในการจัดส่งดี การให้บริการจากร้านค้าดี การให้บริการจากบริษัทขนส่งดี
punnavanakorn,2018-09-16 23:00:39,,5,มีรอยในการขนส่งนิดหน่อย แต่ทางร้านดูแลดีมาก  คุณภาพของสินค้าดีมาก
yuwatidapoprom,2020-04-01 22:29:12,,4,ได้รับของแล้วค่า เร็วมาก
pugunakanitta,2020-09-02 15:46:15,,2,ส่งเร็วมาก แต่สินค้าไม่ไหวเลย เหล็กงอมาก ขาก็ำม่เท่ากัน ทำให้มันเอียงไปข้างนึง ต้องหาอะไรมาลอง 
pantikan14,2020-01-02 12:08:29,,5,วัสดุมีความหนาดีค่ะ แต่ไม่ได้ดูแข็งมาก คุ้มค่ากับราคามากๆ ที่สำคัญส่งของเร็วมากค่ะ
weena_pol,2020-10-15 21:44:53,,4,ขอหัก1ดาวค่ะขาราวไม่เท่ากันวางกับพื้นแล้วโยกได้ค่ะ
themomolita,2018-09-23 13:06:59,,4,
sugar_nancy,2019-04-25 08:39:34,,4,
hataipath42,2020-07-10 13:40:15,,4,
s*****9,2020-07-14 14:39:56,,5,"สินค้ามีคุณภาพราคาถูก สุดยอดค่ะ ไม่ผิดหวังเลยจริงๆ เชิญมาอุดหนุนกันเยอะๆนะค่ะ ""ร้านนี้ดีจริง"" 🥰"
p*****a,2020-11-09 11:42:11,,4,"อันนี้ดีนะคะ ความสูงตากกางขายาวหรือชุดเดรสสบายเลย แต่ส่วนตัวไม่ค่อยชอบเสียงเวลากระทบกันค่อนข้างดัง แต่ก็เข้าใจค่ะ ""เหล็ก"""
,2020-04-07 22:02:00,,3,ตามราคา ใช้งานได้ดี ไม่ต้องไปซื้อแพงมาก
pichitra.tasai,2019-05-30 20:37:29,,5,
keysrir,2020-11-09 23:18:40,,5,ซื้อครั้งที่2 ไม่ผิดหวังเลยคะ สั่งของไปวันที่6/11/63 ได้รับของวันที่9/11/63 รวดเร็วมากคะ 🥰🥰🥰
tan_tan_123,2020-03-04 23:09:50,,5,คุ้มราคา ดูแข็งแรงอยุ่ค่ะ 
12tt12,2020-05-16 23:11:10,,4,โอเคนะสำหรับเรา ก็ตามราคา แต่คุ้ม แข็งแรงดี ในน้ำหนักผ้าที่แขวนพอดี คุ้มค่ะ
s*****t,2020-09-10 22:25:02,,5,
bombsurawat,2020-01-03 13:01:45,,5,
kokfai.2011,2020-04-09 15:38:28,,4,
piyahatai_ting,2018-07-07 13:44:22,,4, การให้บริการจากบริษัทขนส่งดี ความรวดเร็วในการจัดส่งดี การให้บริการจากร้านค้าดี ความคุ้มค่าดี
wareerat.a1993,2020-04-10 21:56:50,,3,
