username,date,variation,rating,comment
j*****d,2022-02-08 12:42:02,,5,"สั่งแล้วส่งเร็วมากดีมากค่ะ

ขอบคุณสำหรับความเป็นเพื่อน
ที่ไม่เคยลบเลือนจางหาย
มีแต่จะยิ่งผูกพันขึ้นมากมาย
คงไม่มีอะไรจะตอบแทนได้ … นอกจากความจริงใจที่ให้เธอ"
m*****e,2022-01-24 12:40:38,,5,ได้รับแล้ว ได้รับแล้ว ได้รับแล้ว ได้รับแล้ว ได้รับแล้ว ได้รับแล้ว ได้รับแล้ว ได้รับแล้ว ได้รับแล้ว ได้รับแล้ว ได้รับแล้ว ได้รับแล้ว ได้รับแล้ว ได้รับแล้ว ได้รับแล้ว ได้รับแล้ว ได้รับแล้ว ได้รับแล้ว ได้รับแล้ว ได้รับแล้ว ได้รับแล้ว ได้รับแล้ว
ten7975352,2021-12-14 12:48:17,,5,คุ้มค่า ราคาถูก จัดส่งรวดเร็ว 👏🏻👏🏻👏🏻👏🏻👏🏻👏🏻👏🏻 คุ้มค่า ราคาถูก จัดส่งรวดเร็ว 👏🏻👏🏻👏🏻👏🏻👏🏻👏🏻👏🏻 คุ้มค่า ราคาถูก จัดส่งรวดเร็ว 👏🏻👏🏻👏🏻👏🏻👏🏻👏🏻👏🏻 คุ้มค่า ราคาถูก จัดส่งรวดเร็ว 👏🏻👏🏻👏🏻👏🏻👏🏻👏🏻👏🏻 คุ้มค่า ราคาถูก จัดส่งรวดเร็ว 👏🏻👏🏻👏🏻👏🏻👏🏻👏🏻👏🏻
a*****a,2021-11-21 12:58:41,,5,"Now the day bleeds
Into nightfall
And you're not here
To get me through it all
I let my guard down
And then you pulled the rug
I was getting kinda used to being someone you loved"
f*****a,2021-11-10 15:05:38,,5,"สินค้าราคาไม่แพง คุณภาพสมราคา
สินค้าราคาไม่แพง คุณภาพสมราคา
สินค้าราคาไม่แพง คุณภาพสมราคา
สินค้าราคาไม่แพง คุณภาพสมราคา"
m*****6,2021-08-02 20:57:55,,5,ได้รับสินค้าแล้ว ทางร้านจัดส่งค่อนข้างเร็ว ช่วงนี้หน้าฝน ต้องมีราวเสริม ราคาไม่แพง คุณภาพสมราคา ซื้อจากร้านนี้เป็นครั้งที่ 2 แล้ว
m*****p,2021-02-20 11:44:20,,5,"สวยไม่ไหวแล้ว
ปั้ง ปั้ง ปั้ง ปั้ง
สุดปัง ปัง ปังปะรังปังปี้
สุดปัง ปังปังหยาอารี
สุดปัง ปัง pretty girls are my bestie
สุดปัง ปังทั้งสนาม look at me now

สวยไม่ไหวแล้ว
ปั้ง ปั้ง ปั้ง ปั้ง
สุดปัง ปัง ปังปะรังปังปี้
สุดปัง ปังปังหยาอารี
สุดปัง ปัง pretty girls are my bestie
สุดปัง ปังทั้งสนาม look at "
s*****1,2020-07-17 23:22:30,,5,ได้รับสินค้าแล้ว โอเคตรงตามปกที่ลงขายไว้ ขนส่งส่งเร็ว ส่งเมื่อวานวันนี้ตอนเช้าได้ สุดยอดจริงๆ ไว้รอบหน้าจะอุดหนุนใหม่
p*****p,2020-10-13 12:16:47,,4,ได้คับสินค้าเรียบร้อย แพ็คสินค้ามาหนาแน่นดี แต่ให้คะแนน 4 ดาว เนื่องจาก สินค้ามีรอยบุบและสนิม น็อตขันเกลียวล็อคด้านข้างเชื่อมไม่ติดกับขาแขวน เท่าไหร่ ..แต่โดยรวมถือว่าโอเคร สมราคาค่ะ..
thanarakkate,2021-01-22 00:35:20,,5,สินค้าคุณภาพดี คุ้มราคา ส่งสินค้าไว ดูแข็งแรงดีค่ะ ดีๆๆๆๆๆๆๆๆๆๆๆๆๆๆๆๆๆๆๆๆๆๆๆๆๆๆๆๆๆๆๆๆๆๆๆๆๆๆๆๆๆๆๆๆๆๆๆๆๆๆๆๆๆๆๆๆๆๆๆๆๆ
nierknanumcheaw,2020-07-11 00:24:37,,2,สินค้าไม่ดีเลยครั้งนี้ก่อนส่งน่าจะลองประกอบก่อนนะว่าใช้ได้หรือเปล่าการเชื่อมราวแขวนเอียงมากๆตั้งไม่ได้เลยแต่ก็ขี้เกียจแพ็กของส่งคืนข้อดีอย่างเดียวคือส่งเร็วแต่สินค้าแย่มาก
pimpornk,2021-01-30 08:31:54,,5,"เหมาะสมกับราคาเหมาะสมกับราคา
เหมาะสมกับราคา
เหมาะสมกับราคา
เหมาะสมกับราคา

เหมาะสมกับราคา
เหมาะสมกับราคา
เหมาะสมกับราคา
เหมาะสมกับราคา
เหมาะสมกับราคา
"
aot48,2021-01-19 21:17:15,,5,"ร้านค้าจัดส่งมารวดเร็วมาก
แพ็คเกจสินค้ามาดีไม่มีเสียหายอะไรเลย
สินค้าดี วัสดุดี คุณภาพดี ของแท้
ราคาเหมาะสม
ประกอบใช้งานได้ดี สวยงามครับ"
sudaratkodcharat,2020-11-27 19:01:50,,5,ซื้อกับร้านนี้เป็นครั้งที่2แล้วค่ะราคาถูกดี คุ้มค่าค่ะ👍🏻👍🏻👍🏻👍🏻👍🏻👍🏻👍🏻👍🏻👍🏻👍🏻👍🏻👍🏻👍🏻👍🏻👍🏻👍🏻👍🏻👍🏻👍🏻👍🏻👍🏻👍🏻👍🏻👍🏻👍🏻👍🏻👍🏻
p*****t,2020-12-12 18:06:56,,5,"ร้านจัดส่งสินค้าได้เร็ว สินค้าไม่เสียหาย คุ้มค่าคุ้มราคา

ร้านจัดส่งสินค้าได้เร็ว สินค้าไม่เสียหาย คุ้มค่าคุ้มราคา"
aot48,2021-01-25 01:05:32,,5,"ร้านค้าจัดส่งมารวดเร็วมาก
แพ็คเกจสินค้ามาดีไม่มีเสียหายอะไรเลย
สินค้าดี วัสดุดี คุณภาพดี ของแท้
ราคาเหมาะสม"
aot48,2021-01-24 22:59:23,,5,"ร้านค้าจัดส่งมารวดเร็วมาก
แพ็คเกจสินค้ามาดีไม่มีเสียหายอะไรเลย
สินค้าดี วัสดุดี คุณภาพดี ของแท้
ราคาเหมาะสม"
v*****t,2021-01-26 08:29:47,,5,ทางร้านค้าจัดส่งสินค้าได้อย่างรวดเร็วค่ะ สินค้าแพ็คมาเป็นอย่างดีค่ะ ซื้อรอบที่ 2 แล้วค่ะ สินค้ามีคุณภาพค่ะ ราคาไม่แพงค่ะบริษัทขนส่งจัดส่งได้อย่างรวดเร็วค่ะ
p*****n,2020-11-17 06:43:59,,4,คุณภาพของสินค้า จัดว่ามีคุณภาพ น่าใช้มาก และสามารถนำมาใช้งานได้เป็นอย่างดี สีสันของสินค้ามีความสวยงาม การบรรจุสินค้านั้น มีการห่อหุ้มเป็นอย่างดีในระดับนึง สินค้ามีคุณสมบัติเหมาะสมกับราคา+ สามารถนำมาใช้งานได้สะดวก โดยส่วนตัวแล้วชอบและประทับใจในสินค้าชิ้นนี้เป็นอย่างมาก บริษัทส่งดี รวดเร็วดี รอไม่นานเ
v*****t,2021-01-19 17:39:45,,5,ทางร้านค้าจัดส่งสินค้าได้อย่างรวดเร็วค่ะสินค้าราคาไม่แพงค่ะ คุณภาพตามราคาค่ะ ใช้งานได้จริงค่ะ บริษัทขนส่งจัดส่งที่รวดเร็วค่ะ
w*****n,2020-07-04 11:54:01,,5,ส่งไวมากคะ  บริการดีเยี่ยมส่งไวมากคะ  บริการดีเยี่ยมส่งไวมากคะ  บริการดีเยี่ยมส่งไวมากคะ  บริการดีเยี่ยมส่งไวมากคะ  บริการดีเยี่ยม
kannikasangnilaviwat,2020-12-04 19:33:26,,5,ได้รับสินค้าไว. แพคมาอย่างดี คุณภาพกับราคา ถือว่าคุ้มค่า สั่งครั้งที่ 2 สนับสนุนร้านนี้คะ 👏👏👏👏👏👏👏👍👍👍👍👍👍👍😘😍😍😍😍☺️☺️☺️☺️☺️☺️☺️☺️
tuk080498,2020-10-06 16:33:39,,5,ได้รับสินค้าแล้วค่ะ สินค้าแพ็คมาอย่างดี ตรงปกทุกอย่าง พนักงานโทรแจ้งว่ามาส่งสินค้าแล้ว😀😀😀😀😀😀😀😀😀😀😀😀😀😀😀😀😀
sirilukchaiklieng,2020-10-05 18:24:04,,3,เรื่องการจัดส่งถือว่ารวดเร็ว  ส่วนคุณภาพสินค้าถือว่าปานกลาง เหล็กค่อนข้างบาง อายุการใช้งานคงใช้ได้สักระยะหากไว้บริเวณกลางแจ้ง โดนแดดโดนฝนบ่อย
annyaowanart,2021-02-07 12:39:18,,1,สินค้ามัดแน่นมากแกะยากเปิดออกมาเป็นสนิมทั้งขาและมีรอยบุบตอนนี้วันอาทิตย์แชทไปที่ผู้ขายยังไม่มีการตอบกลับคุณภาพคง = ราคาละมั้งคะ สนิททั้ง 3 มุมเลยค่ะ
a*****i,2020-08-05 22:08:31,,5,สั่งเป็นอันที่3 แล้วสินค้าส่งไว ราคาดี 👍🏻👍🏻👍🏻👍🏻👍🏻👍🏻👍🏻👍🏻👍🏻👍🏻👍🏻👍🏻👍🏻👍🏻👍🏻👍🏻👍🏻👍🏻👍🏻👍🏻👍🏻👍🏻👍🏻👍🏻👍🏻👍🏻👍🏻👍🏻👍🏻👍🏻👍🏻👍🏻👍🏻👍🏻👍🏻
m*****6,2020-10-20 19:15:33,,4,ดีงามมาก เหมาะสมกับราคา รอบนี้ได้คอยคืนด้วย ซื้อ2รอบแล้วจ้าร้านนี้ ส่งของไว แพคของดี ชอบๆ แล้วจะอุดหนุนอีกนะฮ๊ะ อิอิ
t*****8,2020-10-13 20:31:20,,5,ได้รับสินค้าแล้วคะ...ทางร้านจัดส่งสินค้าได้อย่างรวดเร็วมากและแพ็คสินค้ามาอย่างดี...ชอบมาคะ...เดี๋ยวสั่งใหม่
t*****8,2021-01-20 19:45:43,,5,"สินค้าคุณภาพดี...ส่งเร็วและแพ็คสินค้ามาอย่างดีเยี่ยม
ไว้โอกาสหน้าอุดหนุนใหม่...สั่งหลายครั้งแล้วสินค้าดี"
d*****s,2020-12-09 11:02:42,,4,ราคาถูก สินค้าใช้งานได้ดี ไม่ได้แข็งแรงมาก แขวนผ้าไม่เยอะก็ใช้ได้นาน ราคาถูก สินค้าใช้งานได้ดี ไม่ได้แข็งแรงมาก แขวนผ้าไม่เยอะก็ใช้ได้นาน ราคาถูก สินค้าใช้งานได้ดี ไม่ได้แข็งแรงมาก แขวนผ้าไม่เยอะก็ใช้ได้นาน ราคาถูก สินค้าใช้งานได้ดี ไม่ได้แข็งแรงมาก แขวนผ้าไม่เยอะก็ใช้ได้นาน ราคาถูก สินค้าใช้งานได้ด
p*****p,2021-07-26 12:45:09,,5,ได้รับของแล้วค่ะ ของคุณภาพดี ประกอบง่าย ได้รับของแล้วค่ะ ของคุณภาพดี ประกอบง่าย ได้รับของแล้วค่ะ ของคุณภาพดี ประกอบง่าย ได้รับของแล้วค่ะ ของคุณภาพดี ประกอบง่าย ได้รับของแล้วค่ะ ของคุณภาพดี ประกอบง่าย ได้รับของแล้วค่ะ ของคุณภาพดี ประกอบง่าย ได้รับของแล้วค่ะ ของคุณภาพดี ประกอบง่าย ได้รับของแล้วค่ะ ของ
prapin168,2020-09-15 10:10:10,,5,ดีเหลือเกินทนทานไม่ล้มง่าย เมื่อพายุฝนเข้า  ดีเหลือเกินทนทานไม่ล้มง่าย เมื่อพายุฝนเข้า  ดีเหลือเกินทนทานไม่ล้มง่าย เมื่อพายุฝนเข้า  ดีเหลือเกินทนทานไม่ล้มง่าย เมื่อพายุฝนเข้า  ดีเหลือเกินทนทานไม่ล้มง่าย เมื่อพายุฝนเข้า  ดีเหลือเกินทนทานไม่ล้มง่าย เมื่อพายุฝนเข้า 
n*****a,2020-08-28 20:48:07,,5,สั่งรอบที2แล้วชอบคะส่งเร็ว🙂🙂🙂🙂🙂🙂🙂🙂🙂🙂🙂🙂🙂🙂🙂🙂🙂🙂🙂🙂🙂🙂🙂🙂🙂🙂🙂🙂🙂🙂🙂🙂🙂🙂🙂🙂🙂🙂🙂🙂🙂🙂🙂🙂🙂🙂🙂🙂🙂🙂🙂🙂🙂🙂🙂🙂🙂🙂🙂🙂🙂🙂🙂🙂🙂🙂🙂🙂🙂🙂🙂🙂🙂🙂
nackzuzaa,2020-10-08 14:44:27,,5,👍🏻👍🏻👍🏻👍🏻👍🏻👍🏻👍🏻👍🏻👍🏻👍🏻👍🏻👍🏻👍🏻👍🏻👍🏻👍🏻👍🏻👍🏻👍🏻👍🏻👍🏻👍🏻👍🏻👍🏻👍🏻👍🏻👍🏻👍🏻👍🏻👍🏻👍🏻👍🏻👍🏻👍🏻👍🏻👍🏻👍🏻👍🏻👍🏻👍🏻👍🏻👍🏻👍🏻👍🏻👍🏻👍🏻👍🏻👍🏻👍🏻👍🏻👍🏻👍🏻👍🏻👍🏻👍🏻👍🏻👍🏻👍🏻👍🏻👍🏻👍🏻👍🏻👍🏻👍🏻👍🏻👍🏻👍🏻👍🏻👍🏻👍🏻👍🏻👍🏻👍🏻👍🏻👍🏻
j*****u,2020-07-11 08:55:04,,5,แพคมาดีมากค่ะ สินค้าส่งเร็ว สินค้าราคาถูก คุ้มค่ามากค่ะ แข็งแรง ให้5ดาวเลยค่ะ แตะนำให้ซื้อเลยร้านนี้เลยค่ะ ของดีราคาถูกแพคมาดีมากค่ะ สินค้าส่งเร็ว สินค้าราคาถูก คุ้มค่ามากค่ะ แข็งแรง ให้5ดาวเลยค่ะ แตะนำให้ซื้อเลยร้านนี้เลยค่ะ ของดีราคาถูกแพคมาดีมากค่ะ สินค้าส่งเร็ว สินค้าราคาถูก คุ้มค่ามากค่ะ แข็งแร
keattisak15,2021-01-22 22:49:36,,5,จัดส่งเร็วมาก ประทับใจมาก จัดส่งเร็วมาก ประทับใจมาก จัดส่งเร็วมาก ประทับใจมาก จัดส่งเร็วมาก ประทับใจมาก จัดส่งเร็วมาก ประทับใจมาก จัดส่งเร็วมาก ประทับใจมาก จัดส่งเร็วมาก ประทับใจมาก จัดส่งเร็วมาก ประทับใจมาก จัดส่งเร็วมาก ประทับใจมาก จัดส่งเร็วมาก ประทับใจมาก จัดส่งเร็วมาก ประทับใจมาก จัดส่งเร็วมาก 
applegrape123,2020-08-20 20:13:41,,5,สินค้าคุ้มค่ากับราคา ส่งไว แพ็คมาดี ประกอบง่าย ราคาถูก ดูแข็งแรงใช้ได้ น่าจะแขวนเสื้อได้เยอะอยู่ ปรับระดับความสูงได้ด้วย สั่งซื้ออีกแน่นอน
minicookieshop,2020-07-29 21:20:37,,4,ได้สินค้าเรียบร้อย  แพคดีแน่นหนา ซื้อมาสองอันเลย มีโยกๆอันนึงขาไม่เท่ากันนิดๆ ของถึงช้านิดหน่อยเพราะติดหยุดยาว ร้านส่งของไวค่ะ
noolekkein,2020-08-01 10:42:33,,3,ได้รับสินค้ามาผิด คุณภาพหนะดี แต่ไม่ใช่สิ่งที่ต้องการจึงให้ 3 ดาว ทางร้านบอกจะคืนเงินแต่เราไม่มีปัญญาหอบไปส่งคืนให้ เพราะมันใหญ่เลยรับไว้
m*****k,2021-02-09 20:13:25,,5,ได้รับสินค้าเรียบร้อย..ครบถ้วนตามที่สั่ง..ส่งไวทันใจค่ะ..ราคาไม่แพง..ชอบที่สามารถกางออกเมื่อใช้และเก็บได้เมื่อไม่ได้ใช้
a*****9,2020-10-09 13:50:53,,5,สินค้าคุณภาพดีโอเคค่ะแต่เวลาประกอบแล้วตรงฐานขาจะโยกเยกหน่อยค่ะ..ทางร้านบริการดีจัดส่งสินค้าไวได้รับรวดเร็วดีค่ะ..
t*****a,2020-09-29 00:49:38,,5,ประทับใจค่ะ ส่งเร็ว ห่อมาดีมากกกๆ แบบมีแรพละก็บับเบิ้ลอีกชั้น ใช้เวลาแกะอยู่สักพักเลยล่ะค่ะ 😂 สินค้าต่อง่ายแข็งแรงดี
k*****4,2020-09-19 12:22:19,,4,ได้รับของเรียบร้อยแล้ว ครบถ้วนตามที่สั่งไป แต่ยังไม่ได้ประกอบลองใช้ดูว่ามีความคงทนแข็งแรงแค่ไหน แต่ก่อนหน้านี้เคยใช้มาแล้ว ถ้าน้ำหนักไม่มากเท่าไหร่ก็ถือว่าใช้ได้แต่ถ้าแขวนน้ำหนักเยอะๆอาจจะมีงอบ้าง
s*****i,2020-09-08 19:13:52,,5,แข็งแรง...ทนทานดีค่ะ...คุ้มมมมมมมมาก......ส่งไวด้วยค่ะ.......ไม่มีตำหนิ.. ตรงปกทุกอย่าง...........คุ้มสุดๆๆๆๆๆ
khunkaiii,2020-10-14 17:28:39,,5,ได้รับสินค้าแล้วเหมาะสมกับราคา ปรับสูงต่ำได้ตามความต้องการ  ขนส่งรวดเร็วทันใจ โดยรวมดี ใช้ได้ เหมาะสำหรับตากผ้า
m*****k,2020-08-19 22:28:19,,5,"สินค้ารับน้ำหนักได้ดีและแข็งแรงพอควร
ร้านค้าจัดส่งให้อย่างเร็ว และแพ็คสินค้าอย่างดี
พอใจสินค้าชิ้นนี้มากครับ"
nantikathongchai,2020-08-17 10:13:55,,5,"คุณภาพสินค้าค่อนข้างดี การให้บริการจากทางร้านการจัดส่งบริษัทดี
สินค้าตรงตามที่ต้องการค่ะ สินค้าตรงปกเหล็กมีความเบา ปรับขึ้นลงได้ขนาดกำลังพอดี ราคาถูกค่ะร้านนี้👍👍👍👍👍👍👍👍👍👍👍👍"
parin0759,2020-11-15 13:35:34,,5,Okkkkkkkkkkkkkkkkkkkkkmkmkmmmmmmmmmmkkmmlllmkkkkkkkkkkkkkkkkkkkkkkkkkkkkjkkkjjjjjjjjkkkkkkkkķkkkkkkkkk
aluangkaew,2020-07-11 20:32:00,,4,สินค้าถือว่าราคาถูก สภาพมีสนิมบ้าง บุบบ้าง ประกอบแล้วโยกเยกนิดหน่อย แต่แขวนผ้าแล้วก็โอเค รับได้ การจัดส่งรวดเร็ว
w*****9,2021-06-12 19:03:33,,5,สินค้าเป็นราวแขวนผ้าแขวนไม่รู้จะหักมั้ย มาประกอบเองไม่ดีตรงนี้(ได้แผล)สภาพสินค้าก็โอเค ความรวดเร็วในการจัดส่งเร็วมาก การให้บริการไม่รู้ดีรึปล่าวเห็นก็กดสั่งซื้อเลยไม่ได้คุยกับใคร แม่ค้าพ่อค้าคงใจดีสินค้าจึงมาถึงเร็ว บรษัทขนส่งก็ดี.
ask556644,2021-01-22 19:59:50,,4,"สินค้าตรงปก  คุนภาพพพพพพพ สมราคาาาาาาาาา
น้ำหนักเบาาาาาาาาาาาาาา  ถือว่าใช้ได้จ้าาาาาาาาา
👍👍👍👍👍👏👏👍👍👍👍👍👍👍👍👍👍"
nonstop.gt,2020-11-12 09:35:04,,5,"ของส่งไวค่ะ ได้มาตั้งนานแล้วแต่ยังไม่ได้แกะซักที
พอแกะแล้วเลยมารีวิว สินค้ามาครบค่ะ
ประกอบไม่ยาก ไม่ได้ดูแข็งแรงมากเท่าไหร่ 
แต่ก็น่าจะใช้งานำด้ดีอยู่"
p.aeo,2020-09-24 19:55:04,,5,"ส่งของไวมาก 
ลองใช้บริการของshoppee express ดูก็ดีนะ ส่งไว สุภาพด้วย 
สินค้าดูจากภายนอก น่าจะยังไม่ทีปัญหาอะไร 
ไว้แกะประกอบแล้วมีตรงไหน จะแจ้งไปอีกที 👌🏻 "
