username,date,variation,rating,comment
jariyasrikham,2019-06-15 09:15:24,,4,ขอหัก2 ดาวนะคะ เพราะสินค้าก็คุ้มค่าตามราคามีรอยบุบมาด้วยนิดนึง แต่ ตอนแรกประกอบไม่ได้เพราะมีขี้เหล็กเศษเหล็กที่เก็บงานไม่เรียบร้อยตอนเจาะรูทำให้ราวเข้าล็อคไม่ได้ ต้องให้ช่างใช้สิ่วเจาะให้ค่ะ 
jubzilla,2019-12-20 21:31:48,,4,หัก 1 คะแนน ส่งออกมาล่าช้าจนต้องส่งข้อความถาม สินค้าคุณภาพดี มีความมั่นคงแข็งแรงไม่บอบบาง วัสดุเกรดดีใช้ได้เทียบกับสินค้าแบบเดียวกันที่วางขายแถวๆนี้ ใครที่กำลังมองหาเราแขวนเดี่ยว แนะนำเลยค่ะ
rookmuu99,2019-11-14 21:32:07,,5,สินค้ามาถึงแล้วจ้ะ คุ้มค่า ประหยัดเวลา คุณภาพดี จคดส่ง ประกอบง่าย น้ำหนักเบา พกพาสะดวกจ้า ...................
w*****0,2020-04-17 20:07:19,,5,ดีค่ะ แข็งแรงดี สมราคา🐱🐎🐎🐎🐖🐫🐪🐪🐷🐴🐄🐐🐐🐃🐅🐃🐏🐂🐯🦁🐮🐮🐗🐘🐘🐿🐓🐊🐣🐨🐨🐤🐍🐼🐼🐥🐍🐦🐾🦃🐉🦃🕊🐙🐞🏵⚘💮🐝🐜🐛🐬🦀🦀🦀💐🌸🏵🌹🏵🌸🦂🦂🌸💮🌹🍀🍊🍑🍄🌶🍐🍉🍉☘🍈🍏🌽🌽🌾🍎🍆🍅🍋
spacestudioshop,2020-05-07 09:35:54,,5,"พัสดุห่อมาดีค่ะ สินค้าไม่มีเสียหาย จัดส่งไวมาก 
👍🏻👍🏻👍🏻👍🏻👍🏻👍🏻👍🏻👍🏻👍🏻👍🏻👍🏻👍🏻👍🏻
👍🏻👍🏻👍🏻👍🏻👍🏻👍🏻👍🏻👍🏻👍🏻👍🏻👍🏻👍🏻👍🏻
👍🏻👍🏻"
sumbee,2020-10-11 20:17:30,,5,"ขนส่งรวดเร็วทันใจคะ
ของดีมากคะขนส่งรวดเร็วทันใจคะ
ของดีมากคะขนส่งรวดเร็วทันใจคะ
ของดีมากคะขนส่งรวดเร็วทันใจคะ
ของดีมากคะขนส่งรวดเร็วทันใจคะ
ของดีมากคะขนส่งรวดเร็วทันใจคะ
ของดีมากคะ"
a*****n,2020-05-25 14:08:16,,5,"สั่งที่ร้านหลายอย่างค่ะ​ ห่อมาดีมากๆๆ​  มีกันกระแทกและแน่นหนา​ ประกอบก็ง่าย​ อย่างอื่นที่สั่งมาพร้อมกันก็โอเคมากๆค่ะ
👍👍👍👍👍👍👍👍👍👍👍👍👍👍👍👍👍👍👍👍👍👍👍👍👍👍👍👍👍👍👍👍👍👍👍👍👍👍👍👍👍👍👍👍👍👍👍👍👍👍👍"
attiyah,2020-02-17 22:28:19,,4,คุณ​ภา​พดีราคาถูก​ แข็งแรง💙💙💙💙💙💙💙💙💙💙💙💙💙💙💙💙💙💙💙💙💙💙💙💙💙💙💙💙💙💙💙💙💙💙💙💙💙💙💙💙💙💙💙💙💙💙💙💙💙💙💙💙💙💙💙💙💙💙💙💙💙💙💙💙💙💙💙💙💙💙💙💙💙💙💙💙💙💙💙💙💙💙💙💙💙💙💙💙💙💙💙💙💙💙💙
pinesjung,2019-11-30 10:15:32,,5,รอตอนส่งของนิดหน่อย แต่การจัดส่งแพ็คมาดีแข็งแรง แม่ค้าตอบข้อความตลอด สินค้าคุณภาพโอเค มีโอกาสจะสั่งอีกค่ะ
wipawii,2019-06-29 20:30:23,,4,การแพ็ค​สินค้าส่งดี แน่นหนา การขนส่ง​จากบริษัท​ขนส่ง​ดี​ เพิ่งลองประกอบเมื่อวานเย็น ประกอบไม่ยากค่ะ แต่บริเวณเสาข้างหนึ่งเหมือนเป็นสนิม ก็พอรับได้ไม่ขี้เหร่มาก เหมาะสมกับราคาดี
pratonggominda,2020-03-25 14:10:53,,5,คุณภาพสินค้าดีมาก ความคุ้มค่าดีมาก ความรวดเร็วในการจัดส่งดีมาก การให้บริการจากร้านค้าดีมาก  การให้บริการจากบริษัทขนส่งดีมาก สินค้าได้ได้ตามที่สั่ง การแพ็คสินค้าดีมาก
poommimimi,2020-02-07 22:05:25,,5,สินค้าดี จัดส่งโอเค แพ็ดดีๆๆๆๆๆๆๆๆๆๆๆๆๆๆๆๆๆๆๆๆๆๆๆๆๆๆๆๆๆๆๆๆๆๆๆๆๆๆๆๆๆๆๆๆๆๆๆๆๆๆๆๆๆๆๆๆๆๆๆๆๆๆๆๆๆๆๆๆๆๆๆๆๆๆๆๆ
darin.xx,2018-09-20 17:14:42,,5,ความรวดเร็วในการจัดส่งดีมาก สั่ง19 ได้20  การให้บริการจากบริษัทขนส่งดีมาก  คุณภาพของสินค้าดีเสียตรงที่เวลาไขน็อตไม่มีรูรับน็อต ราวอาจเคลื่อนไหวได้ ถ้าแขวนผ้ามากเกินไป โดยรวมดีค่ะ
thara64,2020-05-27 12:56:59,,5,"ได้รับของแล้วค่ะ. สินค้าแพ็คมาอย่างดีแน่นหนา พันพลาาติกหลายรอบมาก ลำบากก็ตอนแกะนี่ละค่ะ😀
สินค้าประกอบง่ายมาก ไม่กี่นาทีก็เสร็จ. มีน้ำหนักเบาเคลื่อนย้ายสะดวก ให้. 5 ดาวเลยค่ะ 👍👍👍👍👍พนักงานส่งของก็น่ารัก อัธยาศัยดีมากค่ะ👍บอกต่อและจะซื้อต่ออีกแน่นอนนนนนน"
auemjung25,2020-01-15 22:57:20,,4,สินค้าคุณภาพดีๆๆๆ เหมาะสมกับราคา ความคุ้มค่าดี แพ็คสินค้ามาอย่างดีๆๆๆๆ ประกอบง่าย การจัดส่งรวดเร็วๆๆๆๆๆๆๆ
smiley_pui,2020-01-14 22:09:06,,4,แพคสินค้ามาแน่นหนามาก ใช้เวลาแกะนานกว่าจะเสร็จ 555 ขอบคุณทางร้านมากนะคะสินค้าไม่มีเสียหายเลย ราวเนื้อเหล็กจะไม่หนามากไม่เหมาะกับแขวนผ้าจำนวนมากหรือหนักเหล็กอาจรับนนได้ไม่ดี
b.bowboww,2020-04-12 17:28:24,,5,"ร้านค้าบริการดีมากกกกกกกกก
ส่งของไวมากกกกกกกกกกกกก
ราคาไม่แพง
ไว้อุดหนุนอีกน้าาาาาาค้าาาาาาาาาาาาาาาา
❤️❤️❤️❤️❤️❤️❤️❤️❤️❤️❤️❤️❤️❤️❤️❤️❤️❤️❤️❤️❤️❤️❤️❤️❤️❤️❤️❤️❤️❤️❤️❤️❤️❤️❤️❤️❤️❤️❤️❤️❤️❤️❤️❤️❤️❤️❤️❤️❤️❤️❤️❤️❤️❤️❤️❤️❤️❤️❤️❤️❤️❤️❤️❤️❤️❤️❤️❤️❤️❤️❤️❤️❤️❤️❤️❤️❤️❤️❤️❤️❤️❤️❤️❤️❤️❤️❤️❤️❤️❤️❤️❤️❤️❤️❤️❤️❤️❤️❤️❤️❤️❤️❤️❤️❤️❤️❤️❤️❤️❤️❤️❤️❤️❤️❤️❤️❤️❤️❤️❤️❤️❤️❤️❤️❤️❤️❤️❤️❤️❤️❤️❤️❤️❤️❤️❤️❤️❤️❤️❤️❤️❤️❤️❤️❤️❤️❤️❤️❤️❤️❤️❤️❤️❤️❤️❤️"
gdmblossomjellyth,2018-08-27 20:03:04,,3, คุณภาพของสินค้าพอใช้ มีสนิมขึ้น การให้บริการจากบริษัทขนส่งพอใช้
b*****l,2020-05-24 14:56:15,,5,ดีมากๆชอบดีมากๆชอบดีมากๆชอบดีมากๆชอบดีมากๆชอบดีมากๆชอบดีมากๆชอบดีมากๆชอบดีมากๆชอบดีมากๆชอบดีมากๆชอบดีมากๆชอบดีมากๆชอบดีมากๆชอบดีมากๆชอบดีมากๆชอบดีมากๆชอบดีมากๆชอบ
luktukata_shops,2020-04-08 16:23:51,,5,สินค้ามีคุณภาพดีมากจะส่งไวดีค่ะคุ้มค่าคุ้มราคา เมื่อเปรียบเทียบกับราคา ช่วงเซลล์ ลดราคาพอดีจึงทำให้เหมาะสมกับราคาค่ะ ความคุ้มค่าดีมาก ความรวดเร็วในการจัดส่งดีมาก การจัดส่ง ถือว่าเร็วมากๆค่ะ โดยรวมแล้วประทับใจ โปร 4 เดือน 4 คุ้มค่ามากๆ
nroyal,2020-04-10 13:01:42,,5,มาส่งตามจำนวน สินค้าดูตรงกับที่สั่ง ออกจะดูเตี้ยๆ กว่าที่คิด เดี๋ยวต้องลองประกอบดูก่อน แพ็คมาดี ห่อด้วยกระดาษลังด้านนอกและมีแร๊พพลาสติกข้างใน ถือว่าแน่นหนาดี
zine2532,2020-11-09 22:34:19,,5,คุณภาพ ของสินค้าดีมาก ควาทคุ้มค่าดีราคาถูก สินค้า เป็นของแท้ ถูกกว่า ข้างนอก  แต่ความรวดเร็วในการส่งถือ ว่า ดีมากประมาณ 4วันได้ของแล้ว ราคาการขนส่งถือว่าถูกมาก ถูกใจ กะสินค้า มากๆๆค่ะ ครั้งหน้า จะมาอุดหนุนร้านค้านี้ ใหม่ ชอบ😍😍😍😍😍😍😍😍
luckxawan,2020-04-16 16:51:41,,3,จัดส่งสินค้ารวดเร็ว ตรงตามที่ออร์เดอร์ไปค่ะ. แต่พาหางออกมา เอาท่อราวแขวนต่อกับ ท่อแต่ละข้างของเสายืน พบว่าข้างนึง รอขนาดไม่เท่ากัน เลยตอกไม่เข้า ต้องเอาคีมมาง้างให้ย้อย ถึงเอาท่อราวแขวนตอกแย็บลงไปในขาตั้งได้สำเร็จเลยไม่ต้องสางของคืน.  ฐานขาเท่ากันไม่โยกเยก
patomthep,2020-03-09 14:35:13,,5,ได้รับสินค้าแล้วคะ ขอบคุณค้าาาาาาาาาาาาาาาาาาาาาาาาาาาาาาาาาาาาาาาาาาาาาาาาาาาาาาาาาาาาาาาาาาาาาาาาาาาาาาาาาาาาาาาาาาาาาาาาาาาาาาาาาาาาาาาาาาาาาาาาาาาาาาาาาาาา
auizakonvika,2018-11-04 00:16:34,,5, คุณภาพของสินค้าดีมาก ความคุ้มค่าดีมาก ความรวดเร็วในการจัดส่งดีมาก การให้บริการจากร้านค้าดีมาก
undeathx,2019-11-07 22:24:34,,5,การจัดส่งสินค้ารวดเร็วมาก การแพ็คสินค้าตามรูป บริษัทขนส่งให้บริการดี วัสดุงานประกอบคุ้มค่ากับราคา อาจจะไม่ค่อยแข็งแรง แต่ก็ใช้ให้ตรงตามวัตถุประสงค์ก็โอเคครับ
s*****9,2020-09-14 11:52:49,,5,ความคุ้มค่าความคุ้มค่าความคุ้มค่าความคุ้มค่าความคุ้มค่าความคุ้มค่าความคุ้มค่าความคุ้มค่าความคุ้มค่าความคุ้มค่าความคุ้มค่าความคุ้มค่าความคุ้มค่าความคุ้มค่าความคุ้มค่าความคุ้มค่าความคุ้มค่าความคุ้มค่าความคุ้มค่าความคุ้มค่าดีมาก
attiyah,2020-03-26 11:44:08,,4,สินค้า​ดีมาก​ก​กก​กก​กก​กก​กก​กก​กก​กก​กก​กก​กก​กก​กก​กก​กก​กก​กก​กก​กก​กก​กก​กก​กก​กก​กก​กก​กก​กก​กก​
attavitkamtorn,2019-06-17 15:33:33,,5,"The product is good with fast delivery service. Price is really reasonable. Service is also good. I will definitely buy from this stote again and happy to recomend to friends for sure.



 
ส่งจากโทรศัพท์มือถือ Huawei ของฉัน"
chortip399,2019-06-01 09:37:40,,4,การจัดส่งสินค้า  รวดเร็วดี แพคสินค้าดี  จัดส่งรวดเร็วดี แพคสินค้า. ห่อหุ้มมาดี. คุณภาพสินค้าดี  คุ้มค่า. คุ้มค่า  คุ้มราคา  คุ้มราคา   ดีๆ. ดีๆ. ดี  ดีดี. ดี ดีคุ้ม
bbyent4,2020-03-25 17:53:58,,5,"สินค้าดีจัดส่งไวค่ะ ชอบมากค่ะ  ❤❤❤❤❤❤💖💖💖❤💖❤❤❤💖❤❤❤❤
สินค้าดีจัดส่งไวค่ะ ชอบมากค่ะ  ❤❤❤❤❤❤💖💖💖❤💖❤❤❤💖❤❤❤❤สินค้าดีจัดส่งไวค่ะ ชอบมากค่ะ  ❤❤❤❤❤❤💖💖💖❤💖❤❤❤💖❤❤❤❤"
p*****a,2020-07-27 03:13:58,,5,คุณภาพดีจัดส่งรวดเร็วบริการดีคุณภาพดีจัดส่งรวดเร็วบริการดีคุณภาพดีจัดส่งรวดเร็วบริการดีคุณภาพดีจัดส่งรวดเร็วบริการดีคุณภาพดีจัดส่งรวดเร็วบริการดีคุณภาพดีจัดส่งรวดเร็วบริการดีคุณภาพดีจัดส่งรวดเร็วบริการดีคุณภาพดีจัดส่งรวดเร็วบริการดีคุณภาพดีจัดส่งรวดเร็วบริการดีคุณภาพดีจัดส่งรวดเร็วบริการดีคุณภาพดีจั
w*****n,2020-07-15 23:36:04,,5,"สินดีค่ะเหมาะกับการใช้ที่หอพัก กระทัดรัดด คุ้มค่า

สินดีค่ะเหมาะกับการใช้ที่หอพัก กระทัดรัดด คุ้มค่า

สินดีค่ะเหมาะกับการใช้ที่หอพัก กระทัดรัดด คุ้มค่า"
annjung622,2019-05-22 14:04:09,,5,ถูกแระดี👍🏻👍🏻👍🏻👍🏻👍🏻👍🏻👍🏻👍🏻👍🏻👍🏻👍🏻👍🏻👍🏻👍🏻👍🏻👍🏻👍🏻👍🏻👍🏻👍🏻👍🏻👍🏻👍🏻👍🏻👍🏻👍🏻🙏🏻🙏🏻🙏🏻🙏🏻🙏🏻🙏🏻🙏🏻🙏🏻🙏🏻🙏🏻👍🏻🙏🏻🙏🏻🙏🏻🙏🏻🙏🏻🙏🏻🙏🏻🙏🏻🙏🏻🙏🏻🙏🏻🙏🏻🙏🏻🙏🏻......................................
thanawat1535,2019-12-13 18:31:37,,5,"รีวิวจากประสบการณ์ส่วนตัว(สั่งรอบที่สอง)
-ห่อสินค้ามาอย่างดี แน่นหนาเหมือนสั่งรอบแรก
-สินค้าแทบไม่มีตำหนิ มีรอยขีดข่วนนิดหน่อยแต่ไม่เสียหาย
-ใช้บริการKerryส่งไวทันใช้จริงๆ 2วันได้รับสินค้าแล้ว
ปล.รอบนี้เราใช้คูปองส่งฟรีจ้า ค่าส่ง105บาทคือฟรีทั้งหมด จ่ายแค่ค่าสินค้า 280บาทเท่านั้น
คุ้มค่า คุ้มราคามากจ้า
😍🤩🥰
"
saknakab,2020-03-21 01:15:13,,5,สินค้าดี คุ้มค่า. คุ้มราคาดีมากครับ แข็งแรงตามที่ควรเป็น😀😀😀😀😀😀😀😀😀😀😀😀😀😀😀😀😀😀😀😀😀😀😀😀😀😀😀😀😀😀😀😀😅😅😅😅😅😅😅😅😅😅😅😅😅😅😅😅😅😅😅😅😅😅😅😅😅😅😅😅😅😅😅😅😅🙂😂🙂🙂😂🙂🙂🙂🙂🙂🙂🙂😂😂😂🙂🙂😂😂😂
aungovn,2020-04-08 16:32:16,,4,ได้รับของแล้ว สั่งวันที่ 5 ได้รัยของวันที่8 แพคมาแน่นหนาดีคะ แต่ประกอบเสร็จแล้วทำไมมันโยกเยก 😀😁😀😂🤣ดัดไปดัดมากลัวมันจะหนักกว่าเดิมใข้มันไปตามนี้ละกัน
sroydara,2020-05-27 22:00:32,,5,"คุณภาพสินค้าดี ความคุ้มค่าดี จัดส่งเร็ว
คุณภาพสินค้าดี ความคุ้มค่าดี จัดส่งเร็ว
คุณภาพสินค้าดี ความคุ้มค่าดี จัดส่งเร็ว
สินค้า แข็งแรง ในระดับนึง"
life.classic,2021-02-03 10:59:12,,5,สินค้าตรงปกค่ะ จัดส่งเร็ว เหล็กไม่หนามากแต่โดยรวมแข็งแรงดี เหมาะกับราคา ชอบปรับระดับได้ ที่สำคัญแพ็คสินค้ามาดีค่ะมีกันกระแทกด้วย รับไปเลย5ดาวจ้า
u*****4,2020-05-13 15:50:30,,4,สินค้ามีคุณภาพดี สมราคา ร้านค้าแพคสินค้ามาได้แน่นหนาดีมาก บริษัทขนส่งสินค้ารวดเร็ว ราวตากผ้าสามารถปรับระดับความสูงได้ ในภาพคือระดับต่ำสุดของราวตากผ้า
nutdanailertsakultum,2019-09-13 13:14:12,,4,สินค้าคุณภาพตามราคา ขอลองใช้งานดูก่อนตอนนี้ให้ 4ดาวสินค้าคุณภาพตามราคา ขอลองใช้งานดูก่อนตอนนี้ให้ 4ดาวสินค้าคุณภาพตามราคา ขอลองใช้งานดูก่อนตอนนี้ให้ 4ดาว
noonki,2019-07-16 21:06:36,,5,ความคุ้มค่ากับราคาเหมาะสมดีมาก คุณภาพของสินค้าตามความเหมาะ การให้บริการจากบริษัทขนส่งดีมาก ุุืุุืว่าคุ้มดีค่ะ ลองแขวนดูแล้วค่อนข้างมั่นคงอยู่อ
cloverg,2019-07-18 21:01:18,,5,ส่วนสูง ขนาดกำลังดี เหมาะกับระเบียงหอพักเรามากค่ะ สูงดี เสื้อผ้าได้รับลม แห้งดี วัสดุดูแข็งแรงทนทานไม่ก๊องแก๊ง คุ้มค่าคุ้มราคาค่ะ การจัดส่งก็ดีมาก ห่อมาอย่างดี ใครอยากได้ของดีราคาถูกเชิญร้านนี้เลยค่ะ คุ้มแน่นอน 
som22894,2020-02-21 19:08:47,,5,สินค้าประกอบง่ายค่ะ ราวดูเหมือนไม่ค่อยแข็งแรง แต่จริงๆแล้วรับน้ำหนักได้เยอะค่ะ ปรับระดับได้ชอบมากค่ะ สั่งมาลองก่อน2อัน ไว้จะสั่งอีกแน่นอนค่ะ
thippawanyonmukda,2020-03-31 13:53:20,,5,Goodๆๆๆๆๆๆๆๆๆๆๆๆๆๆๆๆๆๆๆๆๆๆๆๆๆๆๆๆๆๆๆๆๆๆๆๆๆๆๆๆๆๆๆๆๆๆๆๆๆๆๆๆๆๆๆๆๆๆๆๆๆๆๆๆๆๆๆๆๆๆๆๆๆๆๆๆๆๆๆๆๆๆๆๆๆๆๆๆๆๆๆๆๆๆๆๆๆๆๆๆๆๆๆๆๆๆๆๆๆๆๆๆๆๆๆๆๆๆๆๆๆๆๆๆๆๆๆๆๆๆๆๆๆๆๆๆๆๆๆๆๆๆๆๆๆๆๆๆ
supakkawan,2019-11-30 18:02:32,,4,"ห่อแพ็คของมาดีมาก คุณถาพสินค้าดี คุ้มราคาส่งkerryแพงไปนิส ความรวดเร็วดี
ทดลองใช้รับน้ำหนักได้ดี มีรอยต่อของชิ้นส่วนไม่ค่อยเรียบแต่ไม่มีผลในการใช้งาน"
a*****a,2020-06-13 16:44:00,,4,สินค้าแพ็คมาค่อนข้างโอเค แต่มีบุบนิดหน่อย ไม่ได้เป็นปัญหา ก็เหมาะสมกับราคา ใช้งานได้จริง แต่เป็นเหล็กบางๆ ไม่ได้แข็งแรงมาก จึงไม่เหมาะกับการแขวนผ้าเยอะๆ ซื้อมาเพื่อตากผ้าแค่ไม่กี่ตัวเท่านั้น ถือว่าโอเค จัดส่งเร็ว 
phinghyde_1994,2020-05-03 11:41:09,,5,สินค้าตรงปก ใช้งานได้ดีค่าาา ขนส่งไวด้วย ⭐️⭐️⭐️⭐️⭐️⭐️⭐️⭐️⭐️⭐️⭐️⭐️⭐️⭐️⭐️⭐️⭐️⭐️⭐️⭐️⭐️⭐️⭐️⭐️⭐️⭐️⭐️⭐️⭐️⭐️⭐️⭐️⭐️⭐️⭐️⭐️⭐️⭐️⭐️⭐️⭐️⭐️⭐️⭐️⭐️⭐️⭐️⭐️
horse2208,2020-05-14 07:52:57,,5,"สินค้าที่ได้รับคุณภาพดี 
คุ้มค่าคุ้มราคา
บริษัทขนส่งดี ส่งสินค้ารวดเร็ว
สินค้าอยู่ในสภาพที่สมบูรณ์
ร้านค้าบริการดี
แนะนำร้านนี้จ้า
👍👍👍👍👍"
