username,date,variation,rating,comment
janjirachanda,2019-08-22 11:15:30,,3,"เหมือนของเก่าจ้า แต่ก็โอเคอยู่ พอใช้ได้
👌🏽👌🏽👌🏽👌🏽👌🏽👌🏽👌🏽👌🏽👌🏽👌🏽👌🏽👌🏽👌🏽👌🏽👌🏽👌🏽👌🏽👌🏽👌🏽👌🏽👌🏽👌🏽👌🏽👌🏽👌🏽👌🏽👌🏽👌🏽👌🏽👌🏽👌🏽👌🏽👌🏽👌🏽👌🏽"
maememb,2020-04-08 12:17:12,,4,ส่งไวของสภาพดี สมราคา 👍👍👍👍👍👍👍👍👍👍👍👍👍👍👍👍👍👍👍👍👍👍👍👍👍👍👍👍👍👍👍👍👍👍👍👍👍👍👍👍👍👍👍👍👍👍👍👍👍👍👍👍👍👍👍👍👍👍👍👍👍👍👍👍👍👍👍👍👍👍👍👍👍👍👍👍👍👍👍👍
blancaynegro,2019-11-26 12:09:34,,4,สินค้าคุ้มค่าคุ้มราคา คุณภาพงานแข็งแรงทนทาน การจัดส่งสินค้าไม่ช้าไม่เร็ว โดยรวมผ่านนนนนนนนนนนนนนนนนะคะ
arada_l,2020-04-17 16:36:12,,4,สินค้าดี ตรงตามแบบ ————————————————————————————————————/——————————————————————————————————————————————
walleeyafern,2020-05-27 05:02:43,,5,สินค้าดีมากค่ะ คุณภาพดี คุ้มค่ามากค่ะ จัดส่งรวดเร็วตามที่กำหนดค่ะ การให้บริการจากการขนส่งก็ดีมากค่ะ แพ็คของมาดีค่ะไม่มีเสียหาย ไว้จะมาอุดหนุนใหม่นะคะ
m*****.,2020-07-11 23:08:52,,3,ส่งเร็วมากกก การขนส่งของสินค้าน่าประทับใจมากกก แต่สินค้าแบบขำมากกกกก ก๊องแก๊ง โคลงเคลง น้ำหนักเบา ดูพังง่าย 
w*****k,2020-09-03 19:11:35,,3,คุ้มค่า👍👍👍👍👍👍👍👍👍👍👍👍👍👍👍👍👍👍👍👍👍👍👍👍👍👍👍👍👍👍👍👍👍👍👍👍👍👍👍👍👍👍👍👍👍👍👍👍👍👍👍👍👍👍👍👍👍👍👍👍👍👍👍👍👍👍👍👍👍👍👍👍👍👍👍👍👍👍👍👍👍👍👍👍👍👍👍👍👍👍👍👍👍👍👍👍👍👍👍👍
pair18836,2019-06-27 18:03:24,,3,"สินค้าคุณภาพตามราคา
พอใช้ได้คะ ประกอบแล้วฐานไม่ตรง
เหล็กเป็นสนิม1ชิ้น แต่ไม่มีผลต่อการใช้งาน
〰️〰️〰️〰️〰️〰️〰️〰️〰️"
feemfeem123,2021-02-08 10:24:00,,1,ราวห่วยเเตก สั่งมาก็หัก ก็เบี้ยว จะให้ส่งกลับค่าส่งไม่ออก ใครจะสั่งร้านนี่คิดดีๆเลยนะ เงิน178 ถือว่าทำบุญเเล้วกัน😏ห่วยเเตก 
bananakiiku,2020-04-09 23:04:06,,5,ได้รับสินค้าแล้วคะะ แพคมาอย่างดีหายห่วง วัสดุดี ติดตั้งง่ายเลยคะ 😁😁😁
suparatkhongsenviboonkan,2020-07-20 02:51:03,,4,😄😄😄😄😄😄😄😄😄😄😄😄😄😄😄😄😄😄😄😄😄😄😄😄😄😄😄😄😄😄😄😄😄😄😄😄😄😄😄😄😄😄😄😄😄😄😄😄😄😄😄😄😄😄😄😄😄😄😄😄😄😄😄😄😄😄😄😄😄😄😄😄😄😄😄😄😄😄😄😄😄😄😄😄😄😄😄😄😄😄😄😄😄😄😄😄😄😄😄😄
porpor2562,2020-07-21 16:29:15,,5,ทางร้านแพคสินค้ามาอย่างดี จัดส่งสินค้ารวดเร็ว คุณภาพสินค้าดีมาก อาจมีบุบนิดน่อยแต่โอเคร
tookata111,2019-05-29 20:06:19,,4,ดีค่ะ แต่มีสนิมนิดหน่อย มีรอยบุบนิดหน่อยไม่มีผลต่อการใช้งาน เหมาะสมราคา....................................
number13shop,2020-05-21 09:45:31,,3,ได้รับสินค้าแล้ว ไม่ค่อยตรงตามที่แจ้ง วัสดุไม่แข็งแรงเลย แต่ก็เหมาะสมตามราคาค่ะ การส่งดีห่อมาแน่นหนาดีค่ะ
jomkuantong,2020-04-01 16:34:02,,3,Ddddddddddddddddddd💚💚💚💚💚💚💚💚💚💚💚🧡🧡🧡🧡🧡🧡🧡🧡🧡🧡🧡🧡🥰🥰🥰🥰🥰🥰🥰🥰🥰🥰🥰🥰🥰🥰😷🥰🥰🥰🥰🥰🥰🥰🥰🥰🥰🥰🥰🥰🥰🥰🥰🥰🥰🥰🥰🥰🥰🥰🥰🥰🥰🥰🥰🥰🥰🥰🥰🥰🥰🥰🥰🥰🥰🥰🥰🥰🥰🥰🥰🥰🥰🥰🥰🥰
natkanej_arm,2019-07-16 08:56:57,,3,ได้แล้วครับ  มีเหล็กตรงข้อต่อด้านล่าง หนึ่งจุดนะครับ .............................................นอกนั้นดี
hibin0,2019-10-09 14:35:00,,5,"คุณภาพสินค้าดีมาก การจัดส่งดี ขนส่งบริการดีมาก
คุณภาพสินค้าดีมาก การจัดส่งดี ขนส่งบริการดีมาก
คุณภาพสินค้าดีมาก การจัดส่งดี ขนส่งบริการดีมาก"
ongchanawutce,2020-03-22 22:24:39,,5,ดีๆๆๆๆๆๆๆๆๆๆๆๆๆๆๆๆๆๆฟฟฟฟฟฟฟๆๆๆๆๆๆๆๆๆๆๆ้สนัอยีิรยิลนืนลอัจแนัแันอยีอียอตุปีนิรยิยริจีอคถแัอยีิียอุตอุุิ
n*****7,2020-06-10 23:43:55,,3,ดีอยู่ค่ะแต่ขนส่งปานกลางไม่ช้าไม่เร็ว👏👏👏👏👏👏👏👏👏👏👏👏👏👏👏👏👏👏👏👏👏👏👏👏👏👏👏👏👏👏👏👏👏👏👏👏👏👏👏👏👏👏👏👏👏👏👏👏👏👏👏👏👏👏👏👏👏👏👏👏👏👏👏
k*****9,2020-04-18 20:01:50,,5,ดีค่ะดูทนแข็งแรงดีราคาไม่แพงถูกกว่าร้านอื่นดีค่ะดูทนแข็งแรงดีราคาไม่แพงถูกกว่าร้านอื่นดีค่ะดูทนแข็งแรงดีราคาไม่แพงถูกกว่าร้านอื่นดีค่ะดูทนแข็งแรงดีราคาไม่แพงถูกกว่าร้านอื่นดีค่ะดูทนแข็งแรงดีราคาไม่แพงถูกกว่าร้านอื่นดีค่ะดูทนแข็งแรงดีราคาไม่แพงถูกกว่าร้านอื่นจะลองใช้ไปสักพักว่าทนไหม
jeunefille_oil,2019-06-20 21:17:12,,5,สินค้าดีค่ะ ประกอบงาน แต่ขามันโครงเครงไปหน่อย ทางร้านแพ็กสินค้ามาแน่นหนาดีมาก กว่าจะแกะแต่ละชิ้นออกใช้เวลาสักพักค่ะ แต่ดีนะคะ แน่นหนาดี 
montongtor,2019-11-19 16:40:28,,4,ส่งสินค้าได้รวดเร็วทันใจ  แพคสินค้าดีกว่ารอบที่แล้ว   แต่ยังไม่ได้แกะดูข้างใน  เลยให้แค่4ดาวไปก่อน  แต่ร้านนี้สัางสินค้ามา2รอบแล้วก็ถือว่าเหมาะสมกับราคา 
,2020-04-14 16:02:01,,5,ราวดูแข็งแรงดีค่ะตากผ้าได้เยอะค่ะราวดูแข็งแรงดีค่ะตากผ้าได้เยอะค่ะราวดูแข็งแรงดีค่ะตากผ้าได้เยอะค่ะราวดูแข็งแรงดีค่ะตากผ้าได้เยอะค่ะราวดูแข็งแรงดีค่ะตากผ้าได้เยอะค่ะราวดูแข็งแรงดีค่ะตากผ้าได้เยอะค่ะ
weesritippho,2019-09-29 14:47:36,,5,ลองใช้ตากผ้า ตากถุงนอน ตากตุ๊กตาตัวใหญ่ แล้ว ก็ถือว่าโอเคเลย ถึงรอยเชื่อมจะไม่ค่อยเนี๊ยบเท่าไหร่ แต่ถ้าเทียบกับราคาแล้วก็รับได้อยู่
ktpjack,2020-02-14 14:30:38,,5, จัดส่งช้าไปหน่อย   โดยรวมก็ดีครับ   DDDDDDDDDDDDDDDDDDDDDDDDDDDDDจัดส่งช้าไปหน่อย   โดยรวมก็ดีครับ   DDDDDDDDDDDDDDDDDDDDDDDDDDDDD
sukkon1,2019-11-23 17:05:43,,4,ขาค่อนข้างเบี้ยวไปหน่อย และมีบุบกับเป็นสนิมนิดบ้าง แต่ด้วยความที่ราคาไม่แพงพอรับได้ค่ะ การจัดส่งรวดเร็วดีค่ะ
anupongwongnantar,2020-05-31 16:38:36,,5,ได้รับของแล้วยังไม่ได้ประกอบแต่คิดว่สดีแน่นอน ห่อมาอย่างดี ตอนเย็นจะประกอบนะ  แต่ให่ห้าดาวไปเลยจ้า ✌️🤪🤗😬😬😳
himawari_t,2020-02-12 15:29:22,,5,การจัดส่งสินค้ารวดเร็วถูกใจคุณภาพสินค้าเหมาะสมกับราคาประทับใจสินค้ามีน้ำหนักเบาเคลื่อนย้ายสะดวกการให้บริการจากบริษัทขนส่งดีมาก
jirapronphunngam,2018-08-31 00:34:11,,4, ความรวดเร็วในการจัดส่งดีมากคะ คุณภาพสินค้าภายนอกดีมากคะ แต่ด้านซ้ายช่วงบนใส่เหล็กลงไปได้แต่ล้อกไม่ได้คะ แต่สินค้าใช้ได้คะ เลยให้4ดาวคะ😊
jamnam24hr,2019-08-17 11:47:51,,2,ตรงขาห่อมาไม่ดี แกะออกมางอเลย น่าจะใส่กล่องมามากกว่า ไม่รู้ว่างอมาจากร้านหรือว่างอตอนขนส่ง 
pockygirl477,2020-02-25 11:37:44,,5,"สินค้าแข็งแรงดี ประกอบง่าย เหมาะกับพื้นที่จำกัดแบบคอนโดมากค่ะ
สินค้าแข็งแรงดี ประกอบง่าย เหมาะกับพื้นที่จำกัดแบบคอนโดมากค่ะ"
09102545ab,2019-12-19 10:40:10,,5,ราวตากผ้าดีพอสมควร การส่งรวดเร็ว ห่อดับเบิ้ลมาดีมากๆห่อหนา ระดับความแข็งแรงคุ้มค่าพอราคา ความสูงสามารถปรับได้ไม่เกิน100เมตร
i*****s,2020-04-24 19:53:47,,5,แพคของดี ดูมีราคา ขาตั้งแข็งแรง วางทะแยงก็ได้ วางหงายก็ดี ทำสีได้สวย ก็อวยบ้างหนา ของสมราคา ควรหาไว้ใช้ ไม่เชื่อลองดู กูแนะนำแล้ว 
petchshopphuket,2019-12-06 17:05:13,,5,คุณภาพของสินค้าดีมาก ความคุ้มค่าดีมาก ความรวดเร็วในการจัดส่งดีมาก  การให้บริการจากขนส่งดีมาก การให้บริการจากร้านค้าดีมาก 
jibjib_789,2020-03-11 15:15:10,,4,"ของดีราคาถูกแล้วยังยังแขวนเสื้อผ้าได้เยอะ
ราคาประหยัดกว่าท้องตลาด มาซื้อกันเยอะๆเด้ออ



แต่มีรอยบุ้บนิดหนึ่งแตาก็ยังพอใช้ได้อยู่"
nuttt2507,2020-04-12 20:16:56,,5,ราวเหล็กชุบแช็งแรงคุณภาพดีมากขนส่งได้อย่างรวดเร็วแพ็คห่อมาอย่างดีคุ้มค่ากับราคาที่ซื้อมากๆไว้มีโอกาสจะอุดหนุนใหม่แน่นอน
kanphirom56,2020-03-06 17:39:56,,5,ดีมากเหมาะสมกับราคา เหล็กหนาดี ราคาพอใช้ได้ การขนส่งดีมาก บริการดี คุณภาพสินค้าดี บริการประทับใจดี สมราคา ราคาย่อมเยาว์ 
maylikeadog,2020-03-01 12:22:31,,5,ได้รับสินค้าเรียบร้อยแล้ว ส่งเร็วมาก สินค้าห่อมาดีหนาแน่นมากๆๆ ใช้เวลาแกะนานมาก55555555 สินค้าไม่มีบุบเลย เริ่ดดดดดดด👍🏻
pantitajangsuthivorawat,2020-01-24 17:33:26,,5,ส่งของรวดเร็วดีค่ะ ห่อแน่นหนาดี คุณภาพของพอๆกับราคาค่ะ ใช้แขวนผ้าได้แต่ไม่เยอะมากค่ะ โดยรวมก็ถือว่าดีคุ้มค่าอยู่ค่ะ .
p*****n,2020-12-11 11:12:09,,5,"ประกอบง่ายมีน๊อตมาร์คจุดมาให้แล้วยืดสูงสุดประมาณ155ซม.-160ซม.วัดจากตัวเอง
สวยดีค่ะประกอบง่ายมีน๊อตมาร์คจุดมาให้แล้วยืดสูงสุดประมาณ155ซม.-160ซม.วัดจากตัวเอง
สวยดีค่ะประกอบง่ายมีน๊อตมาร์คจุดมาให้แล้วยืดสูงสุดประมาณ155ซม.-160ซม.วัดจากตัวเอง
สวยดีค่ะประกอบง่ายมีน๊อตมาร์คจุดมาให้แล้วยืดสูงสุดประมาณ155ซม."
phuwanai999,2020-04-30 13:10:58,,5,"คุ้มค่ามากๆๆๆๆๆๆๆๆ คุ้มค่ามากๆๆๆๆๆๆๆๆๆ
คุ้มค่ามากๆๆๆๆๆๆๆๆ คุ้มค่ามากๆๆๆๆๆๆๆๆๆ
คุ้มค่ามากๆๆๆๆๆๆๆๆ คุ้มค่ามากๆๆๆๆๆๆๆๆๆ"
tatarusmiiw,2019-12-17 10:10:55,,5,ได้มาแบบแพคคู่เลยคะ ดีมากค่ะ ต่อประกอบง่าย ใช้งานได้จริงค่ะ  ได้มาแบบแพคคู่เลยคะ ดีมากค่ะ ต่อประกอบง่าย ใช้งานได้จริงค่ะได้มาแบบแพคคู่เลยคะ ดีมากค่ะ ต่อประกอบง่าย ใช้งานได้จริงค่ะ
sujidtha1320,2020-07-13 23:21:53,,5,"สินค้าเหมาะสมกับราคา
ขนส่งไวพอสมควร
บริการดี
ตัวสินค้ามีความแข็งแรงแต่ประกอบแล้วโคลงเคลงนิดหน่อย
โดยรวมถือว่าดีค่ะ

"
t*****o,2020-04-16 13:00:01,,5,สอนค้าดีมีคุณภาพ มีความคุ้มค่าคุ้มราคา แข็งแรงทนทาน จัดส่งเร็วมากกกกกก การบริการกรดเวยครับ รู้สึกประทับใจอย่างยิ่ง
s*****d,2020-07-06 14:33:21,,5,"ดีมากกกกกกกกกกกกกกกกกก
ดีมากกกกกกกกกกกกกกกกกก
ดีมากกกกกกกกกกกกกกกกกก
ดีมากกกกกกกกกกกกกกกกกก
ดีมากกกกกกกกกกกกกกกกกก"
b*****t,2020-04-09 09:18:28,,5,ราวตากผ้ามีความแข็งแรงมาก รับน้ำหนักได้เยอะ ไม่เปลืองพื้นที่ สามารถปรับระดับความสูงให้เหมาะสมได้ ไว้จะอุดหนุนเพิ่ม
puy2992,2020-01-03 13:36:46,,5,สินค้าดีมากๆราคาประหยัด จัดส่งเร็ว แพ็คของมาดีมากๆค่ะ10/10
ppl.tools,2019-06-04 13:33:57,,5,แม่ค้าให้คำแนะนำดี ทักไปตอบไว บริการดี สินค้าดีคุ้มค่าเกินราคา 
rungsawan.,2020-05-02 19:30:49,,5,คุณภาพของสินค้าดีมากความคุ้มค่าดีมากความรวดเร็วในการส่งข้อความรวดเร็วในการจัดส่งดีมากความรวดเร็วในการจัดส่งได้เลย
k*****a,2020-06-10 22:24:29,,5,ขนาดกำลังดี คุณภาพตามราคาาาาาาาาาาาาาาาาาาาาาาาาาาาาาาาาาาาาาาาาาาาาาาาาาาาาาาาาาาาาาาาาาาาาาาาาาาาาาา
aumwannapa.,2019-09-10 17:20:25,,5," คุ้มค่าคุ้มราคา หนาแน่นดีค่ะ  ดีดีดีดีดีดีดีดีดีดี

 คุ้มค่าคุ้มราคา หนาแน่นดีค่ะ  ดีดีดีดีดีดีดีดีดีดี

.. .... "
tamkwai,2019-04-20 00:35:43,,5,สินค้าน่าใช้ ราคาดีไม่แพง ได้สินค้า ตามที่สั่ง  ความคุ้มค่าดีมาก การจัดส่งดี แข็งแรง น่าใช้ สวยงาม คุ้มค่าดีมาก
metze26,2020-05-12 21:39:04,,5,"สินค้าดีเยี่ยม รอจัดส่งไม่นาน ราคาถูกกว่าร้านอื่นๆ ค่ะ 

สินค้าดีเยี่ยม รอจัดส่งไม่นาน ราคาถูกกว่าร้านอื่นๆ ค่ะ "
lindaman___,2020-01-04 17:44:44,,5,"ส่งช้าไปนิด แข็งแรงนิดหน่อย สภาพตามราคา
ดีมากกกกกกกกกกกกกกกกกกกกกกกก้าสวบขยา้กำพดเรน่เเะเนย่่ีีักั่่รรีคค"
prakaophannn,2020-03-12 23:53:08,,5,แพ้คโอเคค่ะ คุ้มราคามาก ซื้อตอนลดราคาค่ะ..............................ส่งค่อนข้างไว .....................
dollykuljumrern,2020-06-28 20:39:30,,5,ได้รับสินค้าแล้ว พอใจมาก คุณภาพสินค้าดีมาก ความรวดเร็วในการจัดส่งดีมาก การให้บริการจากร้านค้าดีมากการให้บริการ
pannathat88,2020-04-10 22:32:11,,5,สินค้าแพ็กมาอย่างดีมาก​ แม่ค้าตอบไว​ สินค้าแพ็กมาอย่างดีมาก​ แม่ค้าตอบไว​ สินค้าแพ็กมาอย่างดีมาก​ แม่ค้าตอบไว​ 
g*****a,2020-06-23 12:53:09,,4,จัดส่งรวดเร็ว พี่ที่ขนส่งมาให้บริการดีมาก สินค้าบางกว่าที่คิดไว้ แต่ถือว่าโอเคกับราคาเท่านี้ ไม่ต้องออกไปหาซื้อ ไม่มีตำหนิหรือสนิม
kappuranoi,2020-04-04 20:30:13,,5,การจัดส่งรวดเร็ว ห่อกันกระแทกอย่างดี สินค้าอยู่ในสภาพสมบูรณ์ 100% ต่อง่าย ใช้งานง่าย ราคาเหมาะสมกับคุณภาพ โดยรวมดี
chalitphatsurakul,2020-04-13 21:43:33,,5,ได้รับสินค้าถูกต้องตามที่สั่งไป...... ร้านค้าส่งของเร็ว...สินค้าใช้งานได้จริง​ สินค้าราคาถูก.. แนะนำเลยยยยย
c*****c,2020-07-12 17:51:08,,5,✨👍🏻👍🏻👍🏻👍🏻👍🏻👍🏻👍🏻👍🏻👍🏻👍🏻👍🏻👍🏻💗💗💗💗💗✨✨✨💗💗💗💗👍🏻👍🏻💗💗💗💗👍🏻👍🏻✨👍🏻💗💗💗💗💗👍🏻👍🏻👍🏻👍🏻💗💗👍🏻👍🏻💗👍🏻👍🏻💗💗💗👍🏻✨👍🏻💗✨✨💗👍🏻✨👍🏻💗💗✨✨✨💗💗💗👍🏻💗💗💗💗
dewberry12_shop,2020-03-07 20:41:14,,5,ราคาไม่แพง คุณภาพโอเค ดูแข็งแรง ทนทาน ประกอบง่ายมากๆ น้ำหนักเบา เก็บง่าย พกพาไปขายของได้สบายๆเลยค่ะ ปลื้มปริ่ม
chanya107,2020-08-04 20:01:25,,4,มีรอยบุบหลายรอย แต่ไม่เป็นไร โดยรวมถือว่าโอเค เหมาะสมกับราคา
uscha_aom,2020-06-05 14:12:02,,5,"จัดส่งรวดเร็ว ห่อมาดีมากเลยค่ะ
ทนทานมากๆๆ 👍🏻👍🏻👍🏻👍🏻👍🏻👍🏻👍🏻👍🏻👍🏻👍🏻👍🏻👍🏻👍🏻👍🏻👍🏻👍🏻👍🏻👍🏻👍🏻👍🏻👍🏻👍🏻👍🏻👍🏻👍🏻👍🏻👍🏻👍🏻👍🏻👍🏻👍🏻👍🏻"
supawadee_meejan,2019-04-20 21:18:03,,5,ต่อประกอบแล้ว ดูใช้ได้อยู่นะ แต่อาจจะโยกเยกไปหน่อย แต่ถือว่าคุ้มกับราคานะ การส่งดีมาก แพคของมาแน่นหนาดีค่ะ
numprick,2019-10-12 15:03:51,,5,แข็งแรงมากค่ะ ประกอบง่าย แพ็คสินค้ามาอย่างดีมากกกกจนแกะไม่ค่อยออก ส่งของรวดเร็ว ไม่มีตำหนิ คุณภาพสมราคาค่ะ
sarabenten,2019-07-24 08:24:06,,5,สินค้าคุณภาพดี คุ้มค่าค่ะ คุ้มค่าในการซื้อมาใช้งานในยุคประหยัด บริการแพคสินค้าจากทางร้านดีเยี่ยม ต่อก็ง่าย
